https://cellphones.com.vn/tai-nghe-bluetooth-edifier-x5-pro.html,Tai nghe Bluetooth True Wireless Edifier X5 Pro,Edifier,Liên hệ,tai-nghe-bluetooth-edifier-x5-pro,"Mua Tai nghe Edifier X5 Pro chính hãng - Giá tốt, bảo hành 1 năm, giảm thêm Smember, giao hàng toàn quốc. Mua ngay Edifier X5 Pro tại đây.",Tai nghe: 32.64 x 20.96 x 24.33 mm Hộp sạc: 59 x 48.95 x 27.4 mm,,Chống ồn chủ động ANC,Có,,Sạc nhanh  Chống nước và bụi IP55,Edifier,,Tai nghe: 7 giờHộp sạc: 24 giờ (Tắt ANC),,,,,,,,,,
https://cellphones.com.vn/tai-nghe-bluetooth-alpha-works-flex-100.html,Tai nghe Bluetooth True Wireless Alpha Works FLEX 100,Alpha Works,Liên hệ,tai-nghe-bluetooth-alpha-works-flex-100,"Mua tai nghe Alpha Works FLEX 100 chính hãng - Giá tốt, bảo hành uy tín, giao hàng tận nơi toàn quốc. Mua ngay Alpha Works FLEX 100 tại đây.",,,Pure Bass Sound,Có,Cảm ứng chạm,Kháng nước: IPX6,Alpha Works,,Tai nghe: 8 giờHộp sạc: 27 giờ,,,,,,,,,,
https://cellphones.com.vn/tai-nghe-bluetooth-trusmi-ws17.html,Tai nghe Bluetooth True Wireless Trusmi WS17,Trusmi,Liên hệ,tai-nghe-bluetooth-trusmi-ws17,"Mua tai nghe Trusmi WS17 chính hãng - Giá tốt, bảo hành uy tín, giao hàng tận nơi toàn quốc. Mua ngay Trusmi WS17 tại đây.",,,Chống ồn chủ động ANCChống ồn môi trường ENC,Có,,,Trusmi,,Tai nghe: 8 giờHộp sạc: 18 giờ,,,,,,,,,,
https://cellphones.com.vn/tai-nghe-bluetooth-jbl-tour-pro-3.html,Tai nghe Bluetooth True Wireless JBL Tour Pro 3,JBL,Liên hệ,tai-nghe-bluetooth-jbl-tour-pro-3,"Mua Tai nghe JBL Tour Pro 3 chính hãng - Giá rẻ, bảo hành 12 tháng, Giảm thêm Smember, giao hàng toàn quốc. Mua ngay Tour Pro 3 tại đây.","10,2 mm x 5,1 mm x 2,8 mm","Trọng lượng hộp sạc: 71,8 gram  Trọng lượng tai nghe: 5,6 gram ",Hi-Res JBL Pro Sound,6 mic,,Kháng nước IP55,JBL,,Thời gian phát nhạc với Bluetooth và tắt ANC: lên đến 11 giờ Thời gian phát nhạc với Bluetooth và bật ANC: lên đến 8 giờ Thời gian phát nhạc với Bluetooth và bật True Adaptive ANC: lên đến 7 giờ Thời gian đàm thoại với ANC tắt: lên đến 5.5 giờ,,,,,,,,,,
https://cellphones.com.vn/tai-nghe-chup-tai-baseus-bass-bh1-nc-lite.html,Tai nghe Bluetooth chụp tai Baseus Bass BH1 NC Lite,Baseus,Liên hệ,tai-nghe-chup-tai-baseus-bass-bh1-nc-lite,"Mua Tai nghe Baseus Bass BH1 NC Lite chính hãng - Giá tốt, bảo hành uy tín, giao hàng toàn quốc. Mua ngay Baseus Bass BH1 NC Lite tại đây.",,235 g,Chống ồn môi trường ENCChống ồn chủ động ANCSuperBass 2.0,Có ,Nút bấm vật lýĐiều khiển qua ứng dụng,,Baseus,,Tắt ANC: 80 giờBật ANC: 55 giờ,,,,,,,,,,
https://cellphones.com.vn/tai-nghe-bluetooth-stargo-hero.html,Tai nghe Bluetooth True Wireless StarGO Hero,StarGO,Liên hệ,tai-nghe-bluetooth-stargo-hero,"Mua Tai nghe StarGO Hero chính hãng - Giá tốt, Giảm thêm Smember, bảo hành 12 tháng, giao hàng toàn quốc. Mua ngay StarGO Hero tại đây.",,,Khử tiếng ồn chủ động ANC Âm thanh Stereo Hi-FiAmbient,Có,,Màn hình cảm ứng thông minh,StarGO,,Tai nghe: 6 giờHộp sạc: 24 giờ,,,,,,,,,,
https://cellphones.com.vn/tai-nghe-the-thao-havit-ows929.html,Tai nghe Bluetooth thể thao Havit OWS929,Havit,Liên hệ,tai-nghe-the-thao-havit-ows929,"Mua Tai nghe Havit OWS929 chính hãng - Giá tốt, bảo hành uy tín, giao hàng tận nơi toàn quốc. Mua ngay Havit OWS929 tại đây.",,,,Có,Cảm ứng chạm,,Havit,,Tai nghe: 5 giờ,,,,,,,,,,
https://cellphones.com.vn/tai-nghe-bluetooth-anker-soundcore-p40i.html,Tai nghe Bluetooth True Wireless Anker Soundcore P40i,Anker,Liên hệ,tai-nghe-bluetooth-anker-soundcore-p40i,"Mua tai nghe Anker  Soundcore P40i chính hãng - Giá tốt, bảo hành uy tín, giao hàng tận nơi toàn quốc. Mua ngay Anker Soundcore P40i tại đây.",,58g ,Chống ồn chủ động ANC,Có6 micro,Cảm ứng chạm,Sạc nhanh Chống nước IPX5,Anker,,Tai nghe: Dùng 12 giờHộp sạc: 60 giờ,,,,,,,,,,
https://cellphones.com.vn/tai-nghe-khong-day-qcy-melobuds-neo.html,Tai nghe Bluetooth True Wireless QCY MeloBuds Neo,QCY,Liên hệ,tai-nghe-khong-day-qcy-melobuds-neo,"Mua Tai nghe QCY Melobuds Neo chính hãng - Giá tốt, giảm thêm Smember, bảo hành uy tín, giao hàng toàn quốc. Mua ngay Melobuds Neo tại đây.",Tai nghe: 23.5 x 32.5 mmHộp sạc: 55 x 55 mm,,Tinh chỉnh 9 chế độ EQs,4 mic tích hợp,Chạm cảm ứng,Độ trễ 68msTích hợp đèn LED hiển thị thông số pinChống ồn môi trường ENC,QCY,,Tai nghe: 7 giờHộp sạc: 24 giờ,,,,,,,,,,
https://cellphones.com.vn/tai-nghe-khong-day-soundpeats-opera-05.html,Tai nghe Bluetooth True Wireless SoundPEATS Opera 05,Soundpeats,Liên hệ,T.SP.04,"Mua Tai nghe SoundPEATS Opera 05 chính hãng - Giá tốt, bảo hành uy tín, giao hàng tận nơi toàn quốc. Mua ngay SoundPEATS Opera 05 tại đây.",Tai nghe: 24.30 × 22.46 × 29.03 mmHộp sạc: 69.17 × 30.94 × 44.89 mm,Tai nghe: 7.3 gHộp sạc:58.8 g,Hi-Res AudioChống ồn chủ động ANC,Có 2 micro ,Cảm ứng chạm,Chống ồn môi trường ENCSạc nhanh Chống nước IPX4,Soundpeats,,Tai nghe: 9 giờHộp sạc: 33 giờ ,WQ7033AR,,,,,,,,,
https://cellphones.com.vn/tai-nghe-khong-day-qcy-airlybuds-lite.html,Tai nghe Bluetooth True Wireless QCY Ailybuds Lite (T29),QCY,Liên hệ,tai-nghe-khong-day-qcy-airlybuds-lite,"Mua Tai nghe QCY Ailybuds Lite (T29) chính hãng - Giá tốt, Giảm Smember, bảo hành uy tín, giao toàn quốc. Mua ngay Ailybuds Lite tại đây.",Tai nghe: 20.1 x 17.4 x 34.9 mmHộp sạc: 48.8 x 26.7 x 52 mm,Tai nghe: 3.9g,Tinh chỉnh 9 chế độ EQs,Có,,Độ trễ 68msKháng nước IPX4Chống ồn môi trường ENC,QCY,,Tai nghe: 5 giờHộp sạc: 28 giờ,,,,,,,,,,
https://cellphones.com.vn/tai-nghe-khong-day-soul-s-live-30.html,Tai nghe Bluetooth True Wireless Soul S-LIVE 30,SOUL,Liên hệ,T.SO.02,"Mua Tai nghe không dây Soul S LIVE 30 chính hãng - Giá tốt, bảo hành uy tín, giao hàng tận nơi toàn quốc. Mua ngay Soul S-LIVE 30 tại đây.",,,Chống ồn ENC,Có,,,SOUL,,,,10m,Tai nghe: 8 giờHộp sạc: 30 giờ,,,,,,,
https://cellphones.com.vn/tai-nghe-bluetooth-true-wireless-stargo-s10-pro-anc.html,Tai nghe Bluetooth True Wireless StarGO S10 Pro (ANC),StarGO,Liên hệ,tai-nghe-bluetooth-true-wireless-stargo-s10-pro-anc,"Mua Tai nghe StarGO S10 Pro (ANC) chính hãng - Giá tốt, bảo hành uy tín, giao hàng tận nơi toàn quốc. Mua ngay StarGO S10 Pro (ANC) tại đây.",62 x 51 x 32 mm,,,Có,Cảm ứng ,Hộp sạc hiển thị thông số pin,StarGO,,Tai nghe: 6 giờHộp sạc: 24 giờ,,,,,,,,,,
https://cellphones.com.vn/tai-nghe-bluetooth-true-wireless-huawei-freebuds-7i.html,Tai nghe Bluetooth True Wireless Huawei Freebuds 7i,Huawei,Liên hệ,tai-nghe-bluetooth-true-wireless-huawei-freebuds-7i,"Tai nghe bluetooth Huawei Freebuds 7i chính hãng - Giá rẻ, trả góp tốt, bảo hành uy tín, giao hàng nhanh toàn quốc. Mua Huawei Freebuds 7i giao nhanh",Tai nghe: 31.9 x 21 x 24.6 mmHộp sạc: 57.8 x 57.8 x 27.8 mm,Tai nghe: 5.4 gHộp sạc: 36.5 g,Chống ồn chủ động ANC 4.0Hi-Res Audio WirelessÂm thanh 360°,Có,Cảm ứng chạm,Chống ồn cuộc gọi AI,Huawei,,Tai nghe: 8 giờHộp sạc: 35 giờ (Tắt ANC)Tai nghe: 5 giờHộp sạc: 20 giờ (Bật ANC),,,,,,,,,,
https://cellphones.com.vn/tai-nghe-bluetooth-edifier-wh950nb.html,Tai nghe Bluetooth chụp tai Edifier WH950NB,Edifier,Liên hệ,tai-nghe-bluetooth-edifier-wh950nb,"Mua Tai nghe Bluetooth Edifier WH950NB chính hãng - Giá tốt, bảo hành uy tín, giao hàng tận nơi toàn quốc. Mua ngay Tai nghe Bluetooth Edifier W800BT Plus tại đây.",193 x 169 x 82 mm,296g,Hi-Res Audio &amp; Hi-Res WirelessChống ồn chủ động ANCTinh chỉnh EQ,Có,Cảm ứng chạm,Sạc nhanhChống ồn đàm thoại,Edifier,3.5mm,55 giờ,,,,,,,,,,
https://cellphones.com.vn/tai-nghe-bluetooth-anker-soundcore-p41l.html,Tai nghe Bluetooth True Wireless Anker Soundcore P41i (A3937),Anker,Liên hệ,tai-nghe-bluetooth-anker-soundcore-p41l,"Mua tai nghe Anker Soundcore P41i (A3937) chính hãng - Giá tốt, bảo hành uy tín, giao hàng tận nơi toàn quốc. Mua ngay Anker Soundcore P41i (A3937) tại đây.",59.4 x 29.6 x 75.4 mm,Tai nghe và hộp sạc: 114g,Adaptive ANC,6 Mic AI,Cảm ứng,Sạc dự phòng  Giá đỡ điện thoại  Kháng nước IPX5,Anker,,Tai nghe: 12 giờ  Hộp sạc: 192 giờ,,,,,,,,,,
https://cellphones.com.vn/tai-nghe-khong-day-soundpeats-capsule-3-pro-plus.html,Tai nghe Bluetooth True Wireless SoundPEATS Capsule 3 Pro Plus,Soundpeats,Liên hệ,tai-nghe-khong-day-soundpeats-capsule-3-pro-plus,"Mua Tai nghe Bluetooth SoundPEATS Capsule 3 Pro Plus chính hãng - Giá tốt, bảo hành uy tín, giao hàng tận nơi toàn quốc. Mua ngay SoundPEATS Capsule 3 Pro Plus tại đây.",Tai nghe (L x W x H): 33.57 × 21.53 × 25.61mm Hộp sạc (L x W x H): 50.07 × 67.31 × 25.9mm,111g,Chống ồn chủ động ANCHi-Res,Có 6 micro,Cảm ứng chạm,Chống nước IPX4,Soundpeats,,Tai nghe: 6.5 giờHộp sạc: 43 giờ,WQ7034AX,,,,,,,,,
https://cellphones.com.vn/tai-nghe-chup-tai-earfun-tune-pro.html,Tai nghe Bluetooth chụp tai EarFun Tune Pro,EarFun,Liên hệ,tai-nghe-chup-tai-earfun-tune-pro,"Mua Tai nghe EarFun Tune Pro chính hãng - Giá tốt, bảo hành uy tín, giao hàng tận nơi toàn quốc. Mua ngay EarFun Tune Pro tại đây.",19.56 x 16.59 x 8.27 cm,500g,Chống ồn chủ động ANCHi-Res AudioTùy chỉnh EQ,Có (4 micro + thuật toán AI),Cảm ứng chạm,Độ trễ 0.055sTính năng kết nối đa điểm,EarFun,3.5mm,Tắt ANC: 120 giờBật ANC: 80 giờ ,,,,,,,,,,
https://cellphones.com.vn/tai-nghe-bluetooth-soundpeats-t3-pro.html,Tai nghe Bluetooth True Wireless SoundPeats T3 Pro (ANC),Soundpeats,Liên hệ,tai-nghe-bluetooth-soundpeats-t3-pro,"Mua tai nghe SoundPeats T3 Pro ANC chính hãng - Giá tốt, Giảm thêm Smember, bảo hành uy tín, giao hàng toàn quốc. Mua SoundPeats T3 Pro tại đây.",Tai nghe: 33.4x22x25mmHộp sạc: 64.7x49.15x32.1mm ,140g,Spatial AudioChống ồn chủ động ANC,Có  4 micro,Cảm ứng chạm,Chống ồn đàm thoại AI Chống nước IPX4,Soundpeats,,Tai nghe: 7 giờ Hộp sạc: 28 giờ,BT8932F,,,,,,,,,
https://cellphones.com.vn/tai-nghe-khong-day-the-thao-baseus-eli-2i-fit.html,Tai nghe Bluetooth thể thao Baseus Eli 2i Fit,Baseus,Liên hệ,tai-nghe-khong-day-the-thao-baseus-eli-2i-fit,"Mua Tai nghe Baseus Eli 2i Fit chính hãng - Giá tốt, bảo hành uy tín, giao hàng tận nơi toàn quốc. Mua ngay Baseus Eli 2i Fit tại đây.",,Tai nghe: 8.8g,Spatial Audio,Có,,Chống ồn môi trường ENC,Baseus,,Tai nghe: 11 giờHộp sạc: 36 giờ,,,,,,,,,,
https://cellphones.com.vn/tai-nghe-khong-day-xiaomi-redmi-buds-5.html,Tai nghe Bluetooth True Wireless Xiaomi Redmi Buds 5,Xiaomi,Liên hệ,tai-nghe-khong-day-xiaomi-redmi-buds-5,"Mua Tai nghe Xiaomi Redmi Buds 5 chính hãng - Giá rẻ, trả góp 0%, bảo hành 1 năm, giao hàng toàn quốc. Mua ngay Redmi Buds 5 tại đây.",Tai nghe: 29.5 x 21.4 x 23.5mm Hộp sạc: 61 x 50 x 24.6mm,Tai nghe: 5.3g mỗi bên  Hộp sạc: 31.4g ,Hi-Fi ,Có 2 micro ,Cảm ứng chạm,Chế độ chống ồn chủ động ANC,Xiaomi,,Tai nghe: 10 giờHộp sạc: 40 giờ,,,,,,,,,,
https://cellphones.com.vn/tai-nghe-tws-havit-tw972-anc.html,Tai nghe Bluetooth True Wireless Havit TW972,Havit,Liên hệ,tai-nghe-tws-havit-tw972-anc,"Mua Tai nghe Bluetooth True Wireless Havit TW972 chính hãng - Giá tốt, bảo hành uy tín, giao hàng tận nơi toàn quốc. Mua ngay Havit TW972 tại đây.",,,,,,,Havit,,,,,,,,,,,,
https://cellphones.com.vn/tai-nghe-khong-day-xiaomi-redmi-buds-6-pro.html,Tai nghe không dây Xiaomi Redmi Buds 6 Pro,Xiaomi,Liên hệ,tai-nghe-khong-day-xiaomi-redmi-buds-6-pro,"Mua Tai nghe không dây Xiaomi Redmi Buds 6 pro chính hãng - Giá rẻ, Giảm Smember, bảo hành uy tín, giao toàn quốc. Mua ngay Redmi Buds 6 pro tại đây",Tai nghe: 30.6x21.4x24.5 mm  Hộp sạc: 61.05x48.28x25.17 mm,Khoảng 5.2g(tai nghe)/ 46.5g(tổng),Đạt chuẩn Hi-Res Audio và hỗ trợ codec âm thanh LDAC.,"3 Micro AI cho khả năng gọi điện rõ ràng, chống tạp âm gió 12m/s",,Chống ồn chủ động 55dB/4kHz với 20 chế độ chống ồn ,Xiaomi,,Tai nghe: 9 giờ (tắt ANC)Hộp sạc: 36 giờ (tắt ANC),,,,,,,,,,
https://cellphones.com.vn/tai-nghe-nhet-tai-riversong-airfly-l7.html,Tai nghe Bluetooth True Wireless Riversong Airfly L7,Riversong,Liên hệ,tai-nghe-nhet-tai-riversong-airfly-l7,"Mua tai nghe Riversong Airfly L7 chính hãng - Giá tốt, bảo hành uy tín, giao hàng tận nơi toàn quốc. Mua ngay Riversong Airfly L7 tại đây.",,,Chống ồn môi trường ENC,Có,Cảm ứng chạm,Tự động kết nối khi mở nắpKháng nước IPX5,Riversong,Type C,Tai nghe: 5 giờ Hộp sạc: 30 giờ,,,,,,,,,,
https://cellphones.com.vn/tai-nghe-bluetooth-chup-tai-havit-h670bt-anc.html,Tai nghe bluetooth chụp tai Havit H670BT ANC (Space S1),Havit,Liên hệ,tai-nghe-bluetooth-chup-tai-havit-h670bt-anc,"Tai nghe bluetooth Havit H670BT (ANC) chính hãng - Giá tốt, ưu đãi hấp dẫn. Chất âm hay, xịn. Bảo hành uy tín. Giao hàng tận nơi toàn quốc.",172.2 x 200.7 x 79.2 mm,258 g,Chống ồn chủ động ANCSpatial AudioHi-Res AudioHi-Res Audio Wireless,Có (5 micro),Nút bấm và Núm vặn vật lý,Chống ồn môi trường ENC,Havit,3.5mm,Bật ANC: 72 giờ Tắt ANC: 100 giờ,,10 m,,,,,,,,
https://cellphones.com.vn/tai-nghe-bluetooth-edifier-x2s.html,Tai nghe Bluetooth True Wireless Edifier X2S,Edifier,Liên hệ,tai-nghe-bluetooth-edifier-x2s,"Mua Tai nghe bluetooth Edifier X2S chính hãng - Giá rẻ, chất lượng bảo hành uy tín, giao hàng nhanh toàn quốc. Mua ngay Edifier X2S tại đây.",,,,Có,,Game mode Chống nước và bụi IP54,Edifier,,Tai nghe: 6.5 giờ Hộp sạc: 19.5 giờ,,,,,,,,,,
https://cellphones.com.vn/tai-nghe-chup-tai-baseus-inspire-xh1.html,Tai nghe Bluetooth chụp tai Baseus Inspire XH1,Baseus,Liên hệ,tai-nghe-chup-tai-baseus-inspire-xh1,"Mua Tai nghe Baseus Inspire XH1 chính hãng - Giá tốt, bảo hành uy tín, giao hàng tận nơi toàn quốc. Mua ngay Baseus Inspire XH1 tại đây.",,256g,Chống ồn chủ động ANCHi-Res AudioDolby Audio,Có,,Chống ồn môi trường ENC,Baseus,,Tắt ANC: 100 giờBật ANC: 65 giờ,,,,,,,,,,
https://cellphones.com.vn/tai-nghe-khong-day-anker-soundcore-r60i-nc-a3959.html,Tai nghe Bluetooth True Wireless Anker Soundcore R60i NC,Anker,Liên hệ,tai-nghe-khong-day-anker-soundcore-r60i-nc-a3959,"Mua tai nghe Anker Soundcore R60i NC chính hãng - Giá tốt, bảo hành uy tín, giao hàng tận nơi toàn quốc. Mua ngay Anker Soundcore R60i NC tại đây.",,,Adaptive ANCHi-Res Audio &amp; LDACHiệu ứng âm thanh 3D Spatial,Có (6 micro AI),Cảm ứng,"Kháng nước, bụi IP55",Anker,,Tai nghe: 10 giờ  Hộp sạc: 50 giờ (Tắt ANC)Tai nghe: 8 giờ  Hộp sạc: 40 giờ (Bật ANC),,,,,,,,,,
https://cellphones.com.vn/tai-nghe-chup-tai-baseus-bowie-h1s.html,Tai nghe Bluetooth chụp tai Baseus Bowie H1S,Baseus,Liên hệ,tai-nghe-chup-tai-baseus-bowie-h1s,"Mua Tai nghe Baseus Bowie H1S chính hãng - Giá tốt, bảo hành uy tín, giao hàng tận nơi toàn quốc. Mua ngay Baseus Bowie H1S tại đây.",173mm (Rộng) x 185mm (Dài),279g,Hi-Res AudioHi-Res WirelessChống ồn chủ động ANCChống ồn môi trường ENC,Có,,,Baseus,,"Thời lượng pin 5 ngàySau một ngày hoạt động, tai nghe này vẫn còn đủ pin vào giờ đi ngủThời gian chơi 60 giờ khi bật ANC  Thời gian phát nhạc 120 giờ khi tắt ANC",,,,,,,,,,
https://cellphones.com.vn/tai-nghe-bluetooth-true-wireless-baseus-bass-ep10-nc.html,Tai nghe Bluetooth True Wireless Baseus Bass EP10 NC,Baseus,Liên hệ,tai-nghe-bluetooth-true-wireless-baseus-bass-ep10-nc,"Mua Tai nghe Baseus Bass EP10 NC chính hãng - Giá tốt, bảo hành uy tín, giao hàng toàn quốc. Mua ngay Baseus Bass EP10 NC tại đây.",,,Chống ồn môi trường ENCChống ồn chủ động ANC24 chế độ EQ,Có ,Cảm ứng chạmĐiều khiển qua ứng dụng,Chống nước: IPX5,Baseus,,Tai nghe: 7 giờHộp sạc: 41 giờ (Tắt ANC),,,,,,,,,,
https://cellphones.com.vn/apple-airpods-3-2022.html,Tai nghe Bluetooth Apple AirPods 3 2022 sạc có dây | Chính hãng Apple Việt Nam,Apple Chính hãng,Liên hệ,NB.457,"Mua tai nghe Apple Airpods 3 2022 chính hãng, giá rẻ, có trả góp, thu cũ đổi mới trợ giá tốt, giao hàng toàn quốc. Mua ngay Airpods 3 2022 tại đây.",,,"Spatial studio, Âm thanh 3D, Dolby Atmos",Có,Cảm biến lực,,Apple Chính hãng,,,Apple H1,,,,,,,,,
https://cellphones.com.vn/tai-nghe-bluetooth-edifier-x2-plus.html,Tai nghe Bluetooth True Wireless Edifier X2 Plus,Edifier,Liên hệ,tai-nghe-bluetooth-edifier-x2-plus,"Mua Tai nghe Bluetooth Edifier X2 Plus chính hãng - Giá tốt, bảo hành uy tín, giao hàng tận nơi toàn quốc. Mua ngay Edifier X2 Plus tại đây.",,Tai nghe: 4.2g Hộp sạc: 35g,,Có,,"Kháng nước, bụi: IP54Thuật toán AI giảm nhiễu, tăng độ rõ khi gọi thoạiĐộ trễ siêu thấp: 0.07 giây Tự động kết nối khi mở nắp – Tự ngắt khi đóng hộp",Edifier,,Tai nghe: 8 giờ  Hộp sạc: 27 giờ,,,,,,,,,,
https://cellphones.com.vn/tai-nghe-khong-day-jbl-wave-buds-2.html,Tai nghe không dây JBL Wave Buds 2,JBL,Liên hệ,tai-nghe-khong-day-jbl-wave-buds-2,"Tai nghe không dây JBL Wave Buds 2 chính hãng - Giá rẻ, hỗ trợ trả góp, Giảm thêm Smember, bảo hành 1 năm, giao toàn quốc. Mua Wave Buds 2 tại đây.",Tai nghe: 21.6 x 15.8 x 20.4mmHộp sạc: 68.9 x 26.7 x 37mm,"Tai nghe: 4,5 g (mỗi bên)  Hộp sạc: 35g ",JBL Pure Bass Sound,Có ,,Chống nước và bụi IP54,JBL,,"Thời gian phát lại lên đến 40 giờ Tận hưởng 10 giờ phát nhạc, cộng thêm ba lần sạc đầy 30 giờ trong hộp sạc ",,,,,,,,,,
https://cellphones.com.vn/tai-nghe-the-thao-edifier-comfo-c.html,Tai nghe Bluetooth thể thao Edifier Comfo C,Edifier,Liên hệ,tai-nghe-the-thao-edifier-comfo-c,"Mua Tai nghe Edifier Comfo C chính hãng - Giá tốt, nhiều ưu đãi, bảo hành uy tín, giao hàng nhanh. Mua ngay Edifier Comfo C tại đây.",Tai nghe: 29 x 17 x 30 mm  Hộp sạc: 67 x 30 x 55 mm ,Tai nghe: 5.8g  Hộp sạc: 55g,,Có,Cảm ứng chạm,Kháng nước: IP56,Edifier,,Tai nghe: 7 giờ Hộp sạc: 21 giờ,,,,,,,,,,
https://cellphones.com.vn/tai-nghe-truyen-dan-xuong-shokz-openfit-air.html,Tai nghe bluetooth Shokz Openfit Air,Shokz,Liên hệ,tai-nghe-truyen-dan-xuong-shokz-openfit-air,"Mua Tai nghe truyền dẫn xương Shokz OpenFit Air chính hãng - Giá rẻ, Giảm thêm Smember, giao hàng toàn quốc. Mua ngay OpenFit Air tại đây.",Dài 4.7 cm - Rộng 4.3 cm - Cao 1.4 cm,Tai nghe: 8.7g ± 0.2gHộp sạc: 56.4g ± 2g,DirectPitch chất lượng âm cao cấpShokz OpenBass tăng cường âm trầm,CóHỗ trợ khử ồn cuộc gọi AI,Cảm ứng chạm,Chống nước &amp; bụi IP54,Shokz,,Tai nghe: 6 giờHộp sạc: 28 giờ,,,,,,,,,,
https://cellphones.com.vn/tai-nghe-bluetooth-true-wireless-oppo-enco-buds-3-pro.html,Tai nghe Bluetooth True Wireless OPPO Enco Buds3 Pro,OPPO,Liên hệ,tai-nghe-bluetooth-true-wireless-oppo-enco-buds-3-pro,"Mua Tai nghe OPPO Enco Buds3 Pro chính hãng - Giá tốt, bảo hành uy tín, giao hàng tận nơi toàn quốc. Mua ngay OPPO Enco Buds3 Pro tại đây.",Tai nghe: 31.09 x 20.28 x 23.29 mm  Hộp sạc: 59.20 x 24.00 x 47.50 mm,Tai nghe: 4.3g ± 0.2g  Hộp sạc: 42.7g ± 2g,Bộ chỉnh âm cá nhân hóa Enco Master,Có,Cảm ứng chạm ,"Kháng nước, bụi chuẩn: IP55  Độ trễ thấp: 47 ms",OPPO,,Tai nghe: 12 giờ Hộp sạc: 42 giờ,,,,,,,,,,
https://cellphones.com.vn/tai-nghe-bluetooth-chup-tai-bowers-wilkins-px8.html,Tai nghe Bluetooth chụp tai Bowers &amp; Wilkins Px8,Bowers &amp; Wilkins,Liên hệ,tai-nghe-bluetooth-chup-tai-bowers-wilkins-px8,"Mua Tai nghe Bowers &amp; Wilkins Px8 chính hãng - Giá tốt, bảo hành uy tín, giao hàng tận nơi toàn quốc. Mua ngay Bowers &amp; Wilkins Px8 tại đây.",189 x 63 x 233 mm,320g,Chống ồn chủ động ANC,Có ,Nút bấm vật lý,Cảm biến nhận diện khi đeo,Bowers &amp; Wilkins,3.5mm,30 giờ,,,,,,,,,,
https://cellphones.com.vn/tai-nghe-chup-tai-sennheiser-momentum-4.html,Tai nghe Bluetooth chụp tai Sennheiser MOMENTUM 4,Sennheiser,Liên hệ,tai-nghe-chup-tai-sennheiser-momentum-4,"Tai nghe chụp tai Sennheiser Momentum 4 chính hãng - Giá tốt, bảo hành uy tín, giao hàng miễn phí toàn quốc. Mua Sennheiser Momentum 4 tại đây.",,,Chống ồn chủ động ANCChế độ xuyên âm,2 micro mỗi bên,Chạm cảm ứng,Tạm dừng thông minhTự động bật/tắt nhanh chóng khi nhấc lên,Sennheiser,3.5mm,60 giờ,,,,,,,,,,
https://cellphones.com.vn/tai-nghe-khong-day-soundpeats-air-4-pro.html,Tai nghe Bluetooth True Wireless SoundPEATS Air4 Pro,Soundpeats,Liên hệ,tai-nghe-khong-day-soundpeats-air-4-pro,"Mua Tai nghe Soundpeats Air 4 Pro chính hãng - Giá tốt, có trả góp, bảo hành uy tín, giao hàng toàn quốc. Mua Soundpeats Air 4 Pro tại đây.",Tai nghe (LxWxH): 34.4x24x20.7mm Hộp sạc (LxWxH): 64×24.2×48.3mm,,Snapdragon Sound &amp; aptX LosslessChống ồn chủ động,Có6 micro,Cảm ứng chạm,Chế độ Gamemode Chống nước IPX4,Soundpeats,,Tai nghe: 6 giờHộp sạc: 26 giờ ,QCC3071,,,,,,,,,
https://cellphones.com.vn/tai-nghe-chup-tai-edifier-es850nb.html,Tai nghe Bluetooth chụp tai Edifier ES850NB,Edifier,Liên hệ,tai-nghe-chup-tai-edifier-es850nb,"Mua Tai nghe Edifier ES850NB chính hãng - Giá tốt, Giảm thêm Smember, bảo hành uy tín, giao toàn quốc. Mua Edifier ES850NB tại đây.",( Dài x Rộng x Cao ): 232.5mm x69.5mm x 198mm,265g,Chống ồn chủ động ANCHi-Res Audio  Hi-Res Audio Wireless,Có,Nút bấm vật lý,Micro chống ồn AI,Edifier,,55 giờ (Tắt ANC),,,,,,,,,,
https://cellphones.com.vn/tai-nghe-bluetooth-trusmi-ws04.html,Tai nghe Bluetooth True Wireless Trusmi WS04,Trusmi,Liên hệ,tai-nghe-bluetooth-trusmi-ws04,"Mua tai nghe Trusmi WS04 chính hãng - Giá tốt, bảo hành uy tín, giao hàng tận nơi toàn quốc. Mua ngay Trusmi WS04 tại đây.",,,,Có,,,Trusmi,,Thời gian đàm thoại: khoảng 3 giờ (âm lượng 80%)  Phát nhạc: khoảng 4 giờ (âm lượng 80%),,,,,,,,,,
https://cellphones.com.vn/tai-nghe-bluetooth-chup-tai-stargo-c200.html,Tai nghe Bluetooth chụp tai StarGO C200,StarGO,Liên hệ,tai-nghe-bluetooth-chup-tai-stargo-c200,"Mua Tai nghe StarGO C200 chính hãng - Giá tốt, bảo hành uy tín, giao hàng tận nơi toàn quốc. Mua ngay StarGO C200 tại đây.",,,Chống ồn chủ động ANC,Có,,,StarGO,,15 giờ,,,,,,,,,,
https://cellphones.com.vn/tai-nghe-bluetooth-sennheiser-accentum-true-wireless.html,Tai nghe Bluetooth chống ồn SENNHEISER Accentum True Wireless,Sennheiser,Liên hệ,tai-nghe-bluetooth-sennheiser-accentum-true-wireless,"Mua Tai nghe SENNHEISER Accentum True Wireless chính hãng - Giá tốt, bảo hành uy tín, giao hàng tận nơi toàn quốc. Mua ngay SENNHEISER Accentum True Wireless tại đây.",,,Âm thanh LossLessChống ồn chủ động ANC,Có,Chạm cảm ứng,Sạc nhanhChế độ TransparencyTuỳ chỉnh âm thanh,Sennheiser,,Tai nghe: 8 giờHộp sạc: 20 giờ,,,,,,,,,,
https://cellphones.com.vn/tai-nghe-khong-day-anker-soundcore-a30i.html,Tai nghe không dây ANKER SOUNDCORE A30I,Hãng khác,Liên hệ,tai-nghe-khong-day-anker-soundcore-a30i,"Mua Tai nghe không dây ANKER SOUNDCORE A30I chính hãng - Giá tốt, bảo hành uy tín, giao hàng tận nơi toàn quốc. Mua ngay Tai nghe không dây ANKER SOUNDCORE A30I tại đây.",,," Công nghệ BassUp ™M ,  ANC đa chế độ cho các môi trường khác nhau",Có,,,Hãng khác,,,,,,,, Cuộc gọi được hỗ trợ bởi Al: 4 micrô + thuật toán Al tùy chỉnh để tăng cường cuộc gọi.,,,,
https://cellphones.com.vn/tai-nghe-bluetooth-earfun-open-jump.html,Tai nghe Bluetooth True Wireless EarFun OpenJump,EarFun,Liên hệ,tai-nghe-bluetooth-earfun-open-jump,"Mua tai nghe EarFun OpenJump chính hãng - Giá tốt, bảo hành uy tín, giao hàng tận nơi toàn quốc. Mua ngay EarFun OpenJump tại đây.",,,Hi-Res Audio 3D surround,Có,Cảm ứng chạm,Chống ồn môi trường ENCKháng nước: IPX7,EarFun,,Tai nghe: 11 giờHộp sạc: 31 giờ (Tắt LDAC),,,,,,,,,,
https://cellphones.com.vn/tai-nghe-chup-tai-bose-quietcomfort-ultra.html,Tai nghe Bluetooth chụp tai Bose QuietComfort Ultra,Bose,Liên hệ,tai-nghe-chup-tai-bose-quietcomfort-ultra,"Mua Tai nghe Bose QuietComfort Ultra chính hãng - Giá tốt, Giảm 10%, bảo hành 1 năm, giao toàn quốc. Mua ngay Bose QuietComfort Ultra tại đây.",19.5 x 13.9 x 5.08 cm,250g,Chống ồn chủ độngCông nghệ SimpleSync,Có ,,Điều chỉnh âm thanh theo sở thíchMicro khử tiếng ồnChế độ nhận biếtChế độ yên tĩnh,Bose,3.5mm,Tai nghe có thể phát nhạc lên đến 24 giờ ở chế độ Yên tĩnh hoặc Nhận biết (lên đến 18 giờ với Âm thanh đắm chìm),,,,,,,"Nhôm, Da Protein, Nhựa",,,
