https://cellphones.com.vn/apple-airpods-2.html,Tai nghe Bluetooth Apple AirPods 2 | Chính hãng Apple Việt Nam,Apple Chính hãng,Liên hệ,NB.229,"Mua tai nghe Apple Airpods 2 chính hãng Apple, giá rẻ - Trả góp 0% 0Đ phụ phí, 0Đ trả trước, trợ giá lên đời, giao nhanh 2h. Mua Airpod 2 ngay.",,,,Có,Chạm 2 lần,,Apple Chính hãng,,,,10 m,,,,,,,,
https://cellphones.com.vn/tai-nghe-khong-day-sony-wf-c710n.html,Tai nghe Bluetooth True Wireless Sony WF-C710N,Sony,Liên hệ,tai-nghe-khong-day-sony-wf-c710n,"Mua Tai nghe Sony WF-C710N chính hãng - Giá tốt 06/2026, giảm thêm Smember, bảo hành uy tín, giao hàng toàn quốc. Mua WF-C710 tại đây.",,Tai nghe 5.2g,360 Reality AudioÂm thanh kỹ thuật số (DSEE)360 Spatial Sound Personalizer,Micro kép,Cảm ứng,Chống nước IPX4Sử dụng độc lập 1 bên tai,Sony,,Tai nghe: 8 giờHộp sạc: 21.5 giờ,,,,,,,,,,
https://cellphones.com.vn/tai-nghe-khong-day-marshall-motif-ii-anc.html,Tai nghe Bluetooth True Wireless Marshall Motif II ANC,Marshall,Liên hệ,T.MS.01,"Mua Tai nghe không dây Marshall Motif II ANC chính hãng - Giá rẻ, ưu đãi tốt, bảo hành uy tín, giao hàng toàn quốc. Mua Marshall Motif II tại đây.",Dài 3 cm - Rộng 2 cm - Cao 1 cm,Tai nghe: 4.25 g,Chống ồn chủ động ANCMarshall Signature SoundActive Noise Cancelling,Có,Cảm ứng chạm,Chống nước IPX5,Marshall,,Tai nghe: 9 giờHộp sạc: 43 giờ,,,,,,,,,,
https://cellphones.com.vn/tai-nghe-bluetooth-chup-tai-havit-h612bt-pro-anc.html,Tai nghe Bluetooth chụp tai Havit H612BT Pro (ANC),Havit,Liên hệ,tai-nghe-bluetooth-chup-tai-havit-h612bt-pro-anc,"Mua Tai nghe Havit H612BT Pro (ANC) chính hãng - Giá tốt, bảo hành uy tín, giao hàng tận nơi toàn quốc. Mua ngay Havit H612BT Pro (ANC) tại đây.",192 x 182 x 82 mm,191g,Chống ồn chủ động ANC,Có,Nút bấm vật lý,Độ trễ: 60ms,Havit,,50 giờ,,,,,,,,,,
https://cellphones.com.vn/tai-nghe-khong-day-sony-linkbuds-open.html,Tai nghe Bluetooth True Wireless Sony Linkbuds Open (WF-L910),Sony,Liên hệ,tai-nghe-khong-day-sony-linkbuds-open,"Mua Tai nghe Sony Linkbuds Open WF-L910 chính hãng - Giá tốt, Giảm Smember, bảo hành uy tín, giao hàng toàn quốc. Mua Linkbuds Open tại đây.",46 x 46 x 29.4 mm,"Tai nghe: 5,1 gr(x2)  Hộp sạc: 30.6 gr",,Có,,Chống nước IPX4,Sony,,Thời gian phát nhạc: 8h  Thời gian giao tiếp: 4.5h  Thời gian chờ 13h,,,,,,,,,,
https://cellphones.com.vn/tai-nghe-chup-tai-jbl-tour-one-m3.html,Tai nghe Bluetooth chụp tai JBL Tour One M3,JBL,Liên hệ,tai-nghe-chup-tai-jbl-tour-one-m3,"Mua tai nghe JBL Tour One M3 chính hãng - Giá tốt, giảm thêm Smember, bảo hành uy tín, giao toàn quốc. Mua ngay Tour One M3 tại đây.",,278g ,JBL Personi-Fi 3.0Superior Crystal-Clear CallsSeamless SmartTalk,Có,Nút bấm vật lý,Kết nối nhiều thiết bị Auracast™,JBL,3.5mm,Tắt ANC 70 giờBật ANC 40 giờ,,,,,,,,,,
https://cellphones.com.vn/tai-nghe-khong-day-soundpeats-air-5-lite.html,Tai nghe không dây SoundPeats Air 5 Lite,Soundpeats,Liên hệ,tai-nghe-khong-day-soundpeats-air-5-lite,"Mua Tai nghe SoundPeats Air 5 Lite chính hãng - Giá tốt, Giảm thêm Smember, bảo hành uy tín, giao hàng toàn quốc. Mua SoundPeats Air 5 Lite tại đây.",Tai nghe: 34.6 x 17.2 x 17.8mm Hộp sạc: 56 x 51 x 26mm,Tai nghe +Hộp sạc: 44.09g,Codec LDAC,4 micro được trang bị công nghệ lọc ồn,Cảm ứng chạm,Chống nước IPX4,Soundpeats,,Tai nghe: 6 giờ Hộp sạc: 30 giờ,BT8932F,,,,,,,,,
https://cellphones.com.vn/tai-nghe-bluetooth-robot-airbuds-t50s.html,Tai nghe Bluetooth True Wireless Robot Airbuds T50s,Robot,Liên hệ,T.RB.06,"Mua Tai nghe không dây Robot Airbuds T50s chính hãng - Giá tốt, bảo hành uy tín, giao hàng tận nơi toàn quốc. Mua ngay Robot Airbuds T50s tại đây.",,,,Có,Cảm ứng chạm,,Robot,,,,10 m,Tai nghe: 7 giờHộp sạc: 28 giờ,,,,,,,
https://cellphones.com.vn/tai-nghe-bluetooth-jbl-endurance-pace.html,Tai nghe Bluetooth JBL Endurance Pace,JBL,Liên hệ,tai-nghe-bluetooth-jbl-endurance-pace,"Mua Tai nghe Bluetooth JBL Endurance Pace chính hãng - Giá tốt, bảo hành uy tín, giao hàng tận nơi toàn quốc. Mua ngay Tai nghe Bluetooth JBL Endurance Pace tại đây.",,"33,15 g",,2 micro ,,Kết nối đa điểm  Fast Pair (Google)Swift Pair (Microsoft),JBL,,10 giờ,,,,,,,,,,
https://cellphones.com.vn/tai-nghe-khong-day-baseus-eli-fit.html,Tai nghe Bluetooth thể thao Baseus ELI FIT Open-Ear,Baseus,Liên hệ,tai-nghe-khong-day-baseus-eli-fit,"Mua Tai nghe Bluetooth Baseus Eli Fit chính hãng - Giá tốt, nhiều ưu đãi, bảo hành 1 năm, giao hàng toàn quốc. Mua ngay Baseus Eli Fit tại đây.",,9.9 gram ,,Có Màng loa 16.2mm ,Cảm ứng chạm,Sạc nhanhHộp tai nghe hiển thị thông số pin Chống nước IPX4,Baseus,USB,Tai nghe: 7.5 giờHộp sạc: 35 giờ,,,,,,,,,,
https://cellphones.com.vn/tai-nghe-chup-tai-oneodio-a10.html,Tai nghe Bluetooth chụp tai OneOdio A10,Hãng khác,Liên hệ,tai-nghe-chup-tai-oneodio-a10,"Mua Tai nghe OneOdio A10 chính hãng - Giá rẻ 06/2026, Giảm 5% tối đa 200K cho Smember, bảo hành 12 tháng, giao nhanh. Mua OneOdio A10 tại đây.",,,Chống ồn chủ động ANC,Có,,Sạc nhanhXuyên âm,Hãng khác,,,,10m,,,,,,,,
https://cellphones.com.vn/tai-nghe-khong-day-havit-tw982.html,Tai nghe Bluetooth True Wireless Havit 982,Havit,Liên hệ,tai-nghe-khong-day-havit-tw982,"Mua Tai nghe Havit TW 982 chính hãng - Đa dạng mẫu giá tốt, bảo hành uy tín, giảm Smember, giao hàng toàn quốc. Mua ngay Havit TW982 tại đây.",,,,Có,Cảm ứng chạm,Chống ồn môi trường ENCGame Mode,Havit,,,,10m,,,,,,,,
https://cellphones.com.vn/tai-nghe-chup-tai-tronsmart-soundfii-q20s.html,Tai nghe Bluetooth chụp tai Tronsmart Sounfii Q20s,Tronsmart,Liên hệ,tai-nghe-chup-tai-tronsmart-soundfii-q20s,"Mua Tai nghe Tronsmart Sounfii Q20s chính hãng - Giá tốt, bảo hành 1 năm, giảm thêm Smember, giao toàn quốc. Mua ngay Sounfii Q20s tại đây.",186 x 181.9 x 82.3mm,249g,Chống ồn chủ động  Hi-Res Audio Exceptional Sound 2chế độ âm thanh Tùy chỉnh EQ qua ứng dụng,Có,,Đàm thoại rõ ràngTransparency Mode,Tronsmart,3.5mm,60 giờ (Tắt ANC),,,,,,,,,,
https://cellphones.com.vn/tai-nghe-bluetooth-oppo-enco-air-3i.html,Tai nghe Bluetooth True Wireless OPPO Enco Air3i,OPPO,Liên hệ,tai-nghe-bluetooth-oppo-enco-air-3i,"Mua tai nghe OPPO Enco Air3i chính hãng - Giá tốt, bảo hành uy tín, giao hàng tận nơi toàn quốc. Mua ngay OPPO Enco Air3i tại đây.",,,Enco MasterOPPO Alive,Có,Cảm ứng chạm,Khử tiếng ồn AI cho cuộc gọi,OPPO,,,,10m,,Pin sạc Lithium-ion,,,,,,
https://cellphones.com.vn/tai-nghe-khong-day-huawei-freeclip.html,Tai nghe Bluetooth True Wireless HUAWEI FreeClip,Huawei,Liên hệ,tai-nghe-khong-day-huawei-freeclip,"Mua Tai nghe Huawei FreeClip chính hãng, giá rẻ - Tặng đồng hồ Mi Band 8, bảo hành uy tín, giao hàng toàn quốc. Mua Huawei FreeClip tại đây.",Tai nghe: 25.30 mm (Cao) × 22.00 mm (Rộng) × 26.70 mm (Dài) Hộp sạc: 27.35 mm (Cao) × 51.95 mm (Rộng) × 59.70 mm (Dài),Tai nghe: 5.6 g ± 0.3 gHộp sạc: 45.5 g ± 2 g,,Có,Cảm ứng chạm,Kháng nước và bụi IP54 ,Huawei,,Tai nghe: 8 giờ Hộp sạc: 36 giờ,,,,,,,,,,
https://cellphones.com.vn/tai-nghe-khong-day-jbl-wave-beam.html,Tai nghe Bluetooth True Wireless JBL Wave Beam,JBL,Liên hệ,tai-nghe-khong-day-jbl-wave-beam,"Mua Tai nghe JBL Wave Beam chính hãng - Giá rẻ, Giảm thêm smember, bảo hành 12 tháng, giao hàng toàn quốc. Mua ngay JBL Wave Beam tại đây.",Dài 2.35 cm - Rộng 2.186 cm - Cao 3.099 cm,Tai nghe: 8.8g (mỗi bên)Hộp sạc: 39.5g,JBL Deep Bass Sound,Có (1 mic),Chạm cảm ứng hoặc App,Chống nước IP54 ,JBL,,Tai nghe: 8 giờ Hộp sạc: 24 giờ,,,,,,,,,,
https://cellphones.com.vn/tai-nghe-bluetooth-true-wireless-baseus-inspire-xp1.html,Tai nghe Bluetooth True Wireless Baseus Inspire XP1,Baseus,Liên hệ,tai-nghe-bluetooth-true-wireless-baseus-inspire-xp1,"Mua Tai nghe Baseus Inspire XP1 chính hãng - Giá tốt, bảo hành uy tín, giao hàng tận nơi toàn quốc. Mua ngay Baseus Inspire XP1 tại đây.",,,Chống ồn chủ động ANC,Có,,Chống ồn môi trường ENC,Baseus,,Tai nghe: 8 giờ Hộp sạc: 40 giờ,,,,,,,,,,
https://cellphones.com.vn/tai-nghe-khong-day-sony-wf-1000xm5.html,Tai nghe Bluetooth True Wireless Sony WF-1000XM5,Sony,Liên hệ,TN.SN.01,"Tai nghe Sony WF-1000XM5 giá rẻ - Tặng loa sony srs-xe200, lên đời trợ giá tốt, trả góp 0%, giao nhanh. Mua WF-1000XM5 tại đây.",Hộp sạc: 64.6 x 40 x 26.5 mm,Tai nghe: 5.9 gramHộp sạc: 39 gram,Hi-Res Audio DSEE Extreme™Âm thanh 360,Có,Chạm cảm ứng,Chức năng theo dõi đầuChống ồn đàm thoại Chống nước IPX4,Sony,,Tai nghe: 6 giờHộp sạc: 7 giờ (Bật ANC)Tai nghe: 8 giờHộp sạc: 12 giờ (Tắt ANC),,,,,,,,,,
https://cellphones.com.vn/tai-nghe-truyen-dan-xuong-shokz-openmove.html,Tai nghe truyền dẫn xương Shokz Openmove,Shokz,Liên hệ,tai-nghe-truyen-dan-xuong-shokz-openmove,"Mua Tai nghe truyền dẫn xương Shokz Openmove chính hãng - Giá rẻ, ưu đãi tốt, bảo hành uy tín, giao hàng toàn quốc. Mua Shokz Openmove tại đây.",,29 g,PremiumPitch™ 2.02 chế độ EQ,Có ,Chạm cảm ứng,Chống ồn đàm thoại,Shokz,,6 giờ ,,,,,,,,,,
https://cellphones.com.vn/tai-nghe-khong-day-soundpeats-air-4-lite.html,Tai nghe Bluetooth True Wireless SoundPEATS Air 4 Lite,Soundpeats,Liên hệ,tai-nghe-khong-day-soundpeats-air-4-lite,"Mua Tai nghe không dây SoundPEATS Air 4 Lite chính hãng - Giá tốt, bảo hành uy tín, giao hàng tận nơi toàn quốc. Mua ngay SoundPEATS Air 4 Lite tại đây.",Tai nghe (L x W x H): 18.3 x 19.1 x 34.4mm Hộp sạc (L x W x H):  53.5 x 24 x 58mm,4g mỗi bên ,HiRes Audio,Có  6 Micro,Chạm cảm ứng ,Công nghệ giảm ồn cuộc gọi Al  Chống nước	IPX4,Soundpeats,,Tai nghe: 7 giờHộp sạc: 30 giờ,WQ7033AX,,,,,,,,,
https://cellphones.com.vn/tai-nghe-khong-day-huawei-freebuds-5.html,Tai nghe Bluetooth True Wireless Huawei Freebuds 5,Huawei,Liên hệ,tai-nghe-khong-day-huawei-freebuds-5,"Tai nghe Huawei Freebuds 5 chính hãng - Giá rẻ - Tặng Bao Da tai nghe xịn, bảo hành uy tín, giao hàng toàn quốc. Mua Huawei Freebuds 5 tại đây.",,,EQ/ANC/Chống tiếng ồn cuộc gọi chủ động,Có,Cảm ứng chạm,Chứng nhận HWA và Hi-Res,Huawei,,,,,,,,,,,,
https://cellphones.com.vn/tai-nghe-khong-day-xiaomi-buds-5-pro.html,Tai nghe không dây Xiaomi Buds 5 Pro,Xiaomi,Liên hệ,tai-nghe-khong-day-xiaomi-buds-5-pro,"Mua Tai nghe không dây Xiaomi Buds 5 Pro chính hãng - Giá tốt, có trả góp, Giảm thêm Smember, bảo hành 12 tháng, giao hàng toàn quốc. Mua Xiaomi Buds 5 pro tại đây.",Tai nghe: 25.78 × 31.39 × 21.24 mmHộp sạc: 60.5 × 48.45 × 26.79 mm,Tai nghe: 5.6g (±0.1g) Hộp sạc: 41.8g (±0.5g),Hi-Res AudioQualcomm® aptX™ LosslessHarman AudioEFX,3 micro,Cảm ứng chạm,Điều khiển cử chỉ AI để phiên âm và dịch thuậtChống bụi &amp; nước IP54,Xiaomi,,Tai nghe: 8 giờHộp sạc: 40 giờ,,,,,,,,,,
https://cellphones.com.vn/tai-nghe-khong-day-baseus-aequr-g10.html,Tai nghe Bluetooth Wireless Baseus AeQur G10,Baseus,Liên hệ,tai-nghe-khong-day-baseus-aequr-g10,"Mua Tai nghe Baseus AeQur G10 chính hãng - Giá tốt, bảo hành uy tín, giao hàng tận nơi toàn quốc. Mua ngay Baseus AeQur G10 tại đây.",Tai nghe: 35mm (Dài) x 21mm (Rộng)  Hộp sạc: 53mm (Cao) x 30mm (Rộng) x 66mm (Dài),55.1g ,,Có 4 micro ,Cảm ứng chạm,Chống ồn môi trường ENCĐèn RGB,Baseus,,Tai nghe: Dùng 7 giờHộp sạc: Dùng 25 giờ,,,,,,,,,,
https://cellphones.com.vn/tai-nghe-bluetooth-true-wireless-baseus-bass-bs1-nc.html,Tai nghe Bluetooth True Wireless Baseus Bass BS1 NC,Baseus,Liên hệ,tai-nghe-bluetooth-true-wireless-baseus-bass-bs1-nc,"Mua Tai nghe Baseus Bass BS1 NC chính hãng - Giá tốt, bảo hành uy tín, giao hàng toàn quốc. Mua ngay Baseus Bass BS1 NC tại đây.",,,Chống ồn chủ động ANCHi-Res,Có (3 + 3 micro),Cảm ứng chạmĐiều khiển qua ứng dụng,Chống nước &amp; bụi: IP55Độ trễ thấp: 0.06s,Baseus,,Tai nghe: 7 giờHộp sạc: 40 giờ,,,,,,,,,,
https://cellphones.com.vn/tai-nghe-bluetooth-havit-tw981.html,Tai nghe Bluetooth True Wireless Havit TW981,Havit,Liên hệ,tai-nghe-bluetooth-havit-tw981,"Mua Tai nghe Bluetooth Havit TW981 chính hãng - Giá tốt, bảo hành uy tín, giao hàng tận nơi toàn quốc. Mua ngay Havit TW981 tại đây.",,,,Có,Chạm cảm ứng,,Havit,,,,10m,,,,,,,,
https://cellphones.com.vn/tai-nghe-chup-tai-anker-soundcore-q20i.html,Tai nghe Bluetooth chụp tai Anker Soundcore Q20i,Anker,Liên hệ,tai-nghe-chup-tai-anker-soundcore-q20i,"Mua Tai nghe Anker Soundcore Q20i chính hãng - Giá tốt, bảo hành 12 tháng, bảo hành uy tín, giao hàng tận nơi. Mua Soundcore Q20i tại đây.",17.6 x 18.5 x 8.8 cm,244 gram,HiRes AudioChống ồn ANC Transparency,Có4 micro,,,Anker,3.5mm,Tắt ANC: 60 giờBật ANC: 40 giờ,,,,,,,,,,
https://cellphones.com.vn/tai-nghe-khong-day-huawei-freebuds-pro-4.html,Tai nghe không dây Huawei Freebuds Pro 4,Huawei,Liên hệ,tai-nghe-khong-day-huawei-freebuds-pro-4,"Mua Tai nghe Huawei Freebuds Pro 4 chính hãng - Giá rẻ, giảm thêm Smember, góp 0%, giao hàng toàn quốc. Mua ngay Freebuds pro 4 tại đây.",Kích thước mỗi tai nghe: 29.1 x 21.8 x 23.7 mm  Kích thước hộp sạc: 46.9 x 65.9 x 24.5 mm.,Khối lượng tai nghe (1 chiếc): 5.8 g  Khối lượng hộp sạc: 47 g.,HD Spatial Audio,Có,Cảm ứng chạm , IP54 (không áp dụng cho hộp sạc),Huawei,,Tai nghe: 7h  Hộp sạc: 33h,,,,,,,,,,
https://cellphones.com.vn/tai-nghe-chup-tai-sony-wh-ch720n.html,Tai nghe Bluetooth chụp tai Sony WH-CH720N,Sony,Liên hệ,tai-nghe-chup-tai-sony-wh-ch720n,"Mua Tai nghe chụp tai Sony WH-CH720N chính hãng - Giá tốt, đảm bảo chất lượng, bảo hành uy tín, giao hàng toàn quốc. Mua WH-CH720N tại đây.",Dài 26 cm - Rộng 20.8 cm - Cao 5.5 cm,192g,Bộ xử lý tích hợp V1 codec SBC Chống ồn kỹ thuật số Công nghệ ENC Công nghệ lọc tiếng ồn Ambient Sound codec AAC 360 Reality Audio DSEE Adaptive Sound Control Equalizer,Có,Nút bấm vật lý,Tương thích trợ lý ảo,Sony,3.5mm,Bật ANC: 35 giờTắt ANC: 50 giờ,,,,,,,,,,
https://cellphones.com.vn/tai-nghe-khong-day-havit-tw-931.html,Tai nghe Bluetooth True Wireless Havit 931,Havit,Liên hệ,T.HV.56,"Mua Tai nghe Havit TW 931 chính hãng - Giá rẻ, bảo hành 12 tháng, giảm thêm Smember, giao hàng toàn quốc. Mua ngay Havit TW931 tại đây.",,,,Có,Cảm ứng chạm,Chống ồn cuộc gọi,Havit,,,,10m,,,,,,,,
https://cellphones.com.vn/tai-nghe-bose-quietcomfort-earbuds.html,Tai nghe bluetooth Bose Quietcomfort Earbuds,Hãng khác,Liên hệ,tai-nghe-bose-quietcomfort-earbuds,"Mua Tai nghe Bose Quietcomfort Earbuds - Giá tốt, Giảm ngay 200K, bảo hành 12 tháng, giao hàng nhanh. Mua Bose Quietcomfort Earbuds tại đây.",Earbuds: 2.9 x 2.7 x 2.1 cm   Hộp đựng: 3.2 x 8.9 x 5.1 cm,Earbuds: (8.5 g)   Hộp đựng (47.2 g),Khử tiếng ồn ,6 micrô (3 micrô mỗi bên tai nghe),,Kháng nước chuẩn IPX4,Hãng khác,,"Lên đến 8,5 giờ sạc liên tục có nghĩa là âm nhạc của bạn sẽ tiếp thêm năng lượng cho bạn suốt cả ngày  Hộp sạc không dây cũng chứa 2,5 lần sạc cho thời gian nghe lên đến 31,5 giờ",,,,,,,,,,
https://cellphones.com.vn/tai-nghe-bluetooth-stargo-tune.html,Tai nghe Bluetooth True Wireless StarGO Tune,StarGO,Liên hệ,tai-nghe-bluetooth-stargo-tune,"Mua Tai nghe StarGO Tune chính hãng - Giá tốt, bảo hành 12 tháng, giảm thêm Smember, giao hàng toàn quốc. Mua ngay StarGO Tune tại đây.",,,,Có,,Chống nước: IPX4,StarGO,,Tai nghe: 4 giờHộp sạc: 16 giờ,,,,,,,,,,
https://cellphones.com.vn/tai-nghe-chup-tai-earfun-wave-life.html,Tai nghe Bluetooth chụp tai EarFun Wave Life,EarFun,Liên hệ,tai-nghe-chup-tai-earfun-wave-life,"Mua Tai nghe EarFun Wave Life chính hãng - Giá tốt, bảo hành uy tín, giao hàng tận nơi toàn quốc. Mua ngay EarFun Wave Life tại đây.",163.1 x 198.2 x 82.8 mm,264g,Chống ồn chủ động ANCHi-Res AudioTùy chỉnh EQ,Có (4 micro + thuật toán AI),Cảm ứng chạm,Tính năng kết nối đa điểm,EarFun,,Tắt ANC: 60 giờBật ANC: 37 giờ ,,,,,,,,,,
https://cellphones.com.vn/tai-nghe-bluetooth-soundpeats-life.html,Tai nghe Bluetooth True Wireless SoundPEATS Life,Soundpeats,Liên hệ,10.60.123.231.0037,"Mua Tai nghe Bluetooth Soundpeats Life chính hãng - Giá rẻ, đảm bảo chất lượng, độ bền cao, hỗ trợ giao hàng tận nơi toàn quốc.",,,Chip TWS200 Chống ồn chủ động + AI ENCChế độ Game ModeChế độ xuyên âm,Có,Chạm cảm ứng,,Soundpeats,,,,10m,Tai nghe: Dùng 5 giờHộp sạc: Dùng 25 giờ,,,,,,,
https://cellphones.com.vn/tai-nghe-chup-tai-alpha-works-lite-500.html,Tai nghe Bluetooth chụp tai Alpha Works Lite 500,Alpha Works,Liên hệ,tai-nghe-chup-tai-alpha-works-lite-500,"Mua tai nghe Alpha Works Lite 500 chính hãng - Giá tốt, bảo hành uy tín, giao hàng tận nơi toàn quốc. Mua ngay Alpha Works Lite 500 tại đây.",,,,1,,Có thể gấp gọn  Có hỗ trợ cáp AUX,Alpha Works,,Lên đến 30 giờ,,,,,,,,,,
https://cellphones.com.vn/tai-nghe-bluetooth-true-wireless-baseus-bass-bs-2-lite.html,Tai nghe Bluetooth True Wireless Baseus Bass BS2 Lite,Baseus,Liên hệ,tai-nghe-bluetooth-true-wireless-baseus-bass-bs-2-lite,"Mua Tai nghe Baseus Bass BS 2 Lite chính hãng - Giá tốt, bảo hành uy tín, giao hàng toàn quốc. Mua ngay Baseus Bass BS 2 Lite tại đây.",,,Chống ồn môi trường ENC,Có (1 + 1 micro),Cảm ứng chạmĐiều khiển qua ứng dụng,Chống nước: IPX5,Baseus,,Tai nghe: 6 giờHộp sạc: 40 giờ,,,,,,,,,,
https://cellphones.com.vn/tai-nghe-bluetooth-soundpeats-air6-hs.html,Tai nghe Bluetooth True Wireless SoundPEATS Air6 HS,Soundpeats,Liên hệ,tai-nghe-bluetooth-soundpeats-air6-hs,"Mua Tai nghe SoundPEATS Air6 HS chính hãng - Giá tốt, bảo hành uy tín, giao hàng tận nơi toàn quốc. Mua ngay SoundPEATS Air6 HS tại đây.",Tai nghe: 32.53*18.15*19.90mm Hộp sạc: 61.49*27.51*49.36mm,Tai nghe: 4.09g Hộp sạc + tai nghe: 43.18g,Hi-RES ,Khử tiếng ồn khi gọi: 2 Mic ENC,Điều khiển cảm ứng,Chống ồn môi trường ENCKháng nước: IPX5,Soundpeats,,Tai nghe: 9 giờ Hộp sạc: 45 giờ,BT8912F,,,,5V/1A,,,,,
https://cellphones.com.vn/tai-nghe-khong-day-jbl-soundgear-sense.html,Tai nghe Bluetooth thể thao JBL Soundgear Sense,JBL,Liên hệ,tai-nghe-khong-day-jbl soundgear-sense,"Mua Tai nghe thể thao JBL Soundgear Sense chính hãng - Giá rẻ, trả góp 0%, bảo hành 1 năm, giao hàng toàn quốc. Mua Soundgear Sense tại đây.",,,,Có,Cảm ứng chạm,Truyền âm qua không khí,JBL,,,,10 m,,,,,,,,
https://cellphones.com.vn/tai-nghe-truyen-dan-xuong-shokz-openrun.html,Tai nghe Bluetooth truyền dẫn xương Shokz Openrun,Shokz,Liên hệ,T.SH.03,"Mua Tai nghe truyền dẫn xương Shokz Openrun giá rẻ - Bảo hành uy tín, trả góp 0%, giao hàng toàn quốc. Mua ngay Shokz Openrun tại đây.",,26 g,PremiumPitch2.0+,Có,Chạm cảm ứng,Sạc nhanhMicro chống ồn kép Chống nước IP67,Shokz,,8 giờ,,,,,,,,,,
https://cellphones.com.vn/tai-nghe-bluetooth-ugreen-t6.html,Tai nghe Bluetooth True Wireless Ugreen Hitune T6 - WS200,Ugreen,Liên hệ,tai-nghe-bluetooth-ugreen-t6,"Mua Tai nghe Ugreen Hitune T6 - WS200 chính hãng, giá tốt, bảo hành uy tín, giao hàng tận nơi toàn quốc. Mua ngay Hitune T6 - WS200 tại đây.",,Tai nghe: 3.6g,Chống ồn chủ động ANCHi-Res Audio Wireless,Có,Cảm ứng chạm,Sạc nhanhKháng nước IPX5,Ugreen,,Tai nghe: 7 giờHộp sạc: 30 giờ,,,,,,,,,,
https://cellphones.com.vn/tai-nghe-khong-day-soundpeats-runfree-lite-2.html,Tai nghe Bluetooth thể thao SoundPEATS RunFree Lite 2,Soundpeats,Liên hệ,tai-nghe-khong-day-soundpeats-runfree-lite-2,"Mua Tai nghe SoundPEATS RunFree Lite 2 chính hãng - Giá tốt 06/2026, bảo hành uy tín, giao hàng toàn quốc. Mua ngay RunFree Lite 2 tại đây.",,,,Có,,Chống ồn đàm thoạiĐộ trễ thấp,Soundpeats,,,,,,,,,,,,
https://cellphones.com.vn/tai-nghe-chup-tai-edifier-atom-max.html,Tai nghe Bluetooth chụp tai Edifier Atom Max,Edifier,Liên hệ,tai-nghe-chup-tai-edifier-atom-max,"Mua tai nghe Edifier Atom Max chính hãng - Giá tốt, bảo hành uy tín, giao hàng tận nơi toàn quốc. Mua Edifier Atom Max tại đây.",,,Chống ồn chủ động ANCÂm thanh Hi-Res,Có,Nút bấm vật lý,Sạc nhanh,Edifier,,Tắt ANC: 45 giờBật ANC: 25 giờ,,,,,,,,,,
https://cellphones.com.vn/apple-airpods-4.html,Tai nghe Bluetooth Apple AirPods 4 | Chính hãng Apple Việt Nam,Apple Chính hãng,Liên hệ,apple-airpods-4,"Mua Apple AirPods 4 chính hãng - Giá tốt, Trả góp 0%, 0đ Trả trước, 0đ Phụ phí, Giảm 3% Smember, giao hàng nhanh. Mua ngay AirPod 4 tại đây.",Tai nghe: 30.2 x 18.3 x 18.1 mmHộp sạc: 46.2 x 50.1 x 21.2 mm,Tai nghe: 4.3gHộp sạc: 32.3g,Trình điều khiển Apple với độ lệch tương phản cao có thể tùy chỉnh Bộ khuếch đại với độ lệch tương phản cao có thể tùy chỉnh Tách Lời Nói Chế độ Âm Thanh Không Gian Cá Nhân Hóa với tính năng theo dõi chuyển động đầu chủ động EQ Thích Ứng H,Có,Cảm biến lực ,,Apple Chính hãng,,"Thời gian nghe lên đến 5 giờ với một lần sạc Thời gian đàm thoại lên đến 4,5 giờ với một lần sạc",Chip tai nghe H2,,,,,,,,,
https://cellphones.com.vn/tai-nghe-bluetooth-baseus-bowie-e16.html,Tai nghe Bluetooth True Wireless Baseus Bowie E16,Baseus,Liên hệ,tai-nghe-bluetooth-baseus-bowie-e16,"Mua Tai nghe bluetooth Baseus Bowie E16 chính hãng - Giá tốt, bảo hành uy tín, giao hàng nhanh toàn quốc. Mua ngay Bowie E16 tại đây.",Tai nghe: 35.40mm Hộp sạc: 53.34mm x 53.39mm,Tai nghe: 3.2g Hộp sạc: 30g,Khử ồn ENC,Có,Cảm ứng chạm ,Sạc nhanh  Kháng nước chuẩn IPX4,Baseus,Type C,Tai nghe: 6 giờHộp sạc: 30 giờ,,,,,,,,,,
https://cellphones.com.vn/tai-nghe-khong-day-sony-linkbuds-fit.html,Tai nghe không dây Sony Linkbuds Fit (WF-LS910N),Sony,Liên hệ,tai-nghe-khong-day-sony-linkbuds-fit,"Mua Tai nghe Sony Linkbuds Fit (WF-LS910) chính hãng - Giá tốt, nhiều ưu đãi, bảo hành uy tín, giao toàn quốc. Mua Sony Linkbuds Fit tại đây.",47.2 x 47.2 x 32.6 mm,xấp xỉ 4.9 g (x2 tai bao gồm miếng đệm tai),,Có,,Chống nước IPX4,Sony,,Phát nhạc liên tục: 5h (bật chống ồn) - 8h (tắt chống ồn)  Giao tiếp liên tục: tối đa 4h  Thời gian chờ: 6.5 giờ (bật chống ồn) - 14 giờ (tắt chống ồn),,,,,,,,,,
https://cellphones.com.vn/tai-nghe-bluetooth-edifier-wh700.html,Tai nghe Bluetooth chụp tai Edifier WH700NB,Edifier,Liên hệ,tai-nghe-bluetooth-edifier-wh700,"Mua Tai nghe chụp tai Edifier WH700NB chính hãng - Giá tốt, nhiều ưu đãi, bảo hành uy tín, giao hàng nhanh. Mua ngay Edifier WH700NB tại đây.",,271g ,codec âm thanh AAC và SBC,Có,,Sạc nhanh,Edifier,,Bật ANC: 68 giờTắt ANC: 45 giờ,,,,,,,,,,
https://cellphones.com.vn/tai-nghe-bluetooth-edifier-neobuds-pro-3.html,Tai nghe Bluetooth True Wireless Edifier NeoBuds Pro 3,Edifier,Liên hệ,tai-nghe-bluetooth-edifier-neobuds-pro-3,"Mua Tai nghe Bluetooth Edifier NeoBuds Pro 3 chính hãng - Giá tốt, bảo hành uy tín, giao hàng tận nơi toàn quốc. Mua ngay Edifier NeoBuds Pro 3 tại đây.",,,,,,Sạc nhanh,Edifier,,,,,,,,,,,,
https://cellphones.com.vn/tai-nghe-bluetooth-edifier-wh500.html,Tai nghe Bluetooth chụp tai Edifier WH500,Edifier,Liên hệ,tai-nghe-bluetooth-edifier-wh500,"Mua Tai nghe Bluetooth chụp tai Edifier WH500  chính hãng - Giá rẻ, có trả góp, bảo hành uy tín, giao hàng toàn quốc. Mua Edifier WH500 tại đây",163.3 x 67.2 x 184mm,172g ,,Có,,Chế độ âm nhạc &amp; Chế độ trò chơiTuỳ chỉnh EQ qua ứng dụng,Edifier,,Sạc đầy sẽ cung cấp cho bạn 40 giờ phát lại liên tục 10 phút sạc nhanh sẽ cung cấp cho bạn thêm 6 giờ phát lại,,,,,,,,,,
https://cellphones.com.vn/tai-nghe-bluetooth-honor-choice-earbuds-x7e-active.html,Tai nghe Bluetooth True Wireless HONOR CHOICE Earbuds X7e Active,HONOR,Liên hệ,tai-nghe-bluetooth-honor-choice-earbuds-x7e-active,"Mua Tai nghe HONOR CHOICE Earbuds X7e Active chính hãng - Giá tốt, bảo hành uy tín, giao hàng toàn quốc. Mua ngay HONOR CHOICE Earbuds X7e Active tại đây.",Tai nghe: 31.8 x 18.3 x 17.6 mmHộp sạc: 58 x 50 x 24.5 mm,Tai nghe: 4.3g,,Có,Cảm ứng chạm,Công nghệ khử ồn cuộc gọi AIHỗ trợ ghép nối và kết nối qua cửa sổ pop-up,HONOR,,Tai nghe: 7 giờ Hộp sạc: 31 giờ,,,,,,,,,,
