https://cellphones.com.vn/tai-nghe-bluetooth-edifier-t10.html,Tai nghe Bluetooth True Wireless Edifier T10,Edifier,Liên hệ,tai-nghe-bluetooth-edifier-t10,"Mua Tai nghe Edifier T10 chính hãng - Giá tốt, bảo hành 1 năm, giảm thêm Smember, giao hàng toàn quốc. Mua ngay Edifier T10 tại đây.",Tai nghe: 21.79 x 18.07 x 19.12 mm Hộp sạc: 56.98 x49.7 x 26.45 mm,41g,,Có,Cảm ứng chạm,Sạc nhanh  Chống nước và bụi IP54,Edifier,,Tai nghe: 7 giờHộp sạc: 19 giờ,,,,,,,,,,
https://cellphones.com.vn/tai-nghe-chup-tai-gaming-logitech-g435.html,Tai nghe không dây chụp tai Gaming Logitech G435,Logitech,Liên hệ,TN.LOGI.01,"Mua Tai nghe không dây chụp tai Gaming Logitech G435 chính hãng - Giá tốt, bảo hành uy tín, giao hàng tận nơi toàn quốc. Mua ngay Tai nghe không dây chụp tai Gaming Logitech G435 tại đây.",,,,,Nút vật lý,163×170×71 mm,Logitech,,,,,18 giờ,,,,,,,
https://cellphones.com.vn/tai-nghe-truyen-dan-xuong-shokz-openrun-pro-2.html,Tai nghe Bluetooth thể thao Shokz OpenRun Pro 2,Shokz,Liên hệ,tai-nghe-truyen-dan-xuong-shokz-openrun-pro-2,"Mua tai nghe Shokz OpenRun Pro 2 chính hãng - Giá tốt, bảo hành uy tín, giao hàng tận nơi toàn quốc. Mua ngay Shokz OpenRun Pro 2 tại đây.",,30.3g,Công nghệ DualPitchCông nghệ DRC,Có,,Sạc nhanh  Kháng nước và mồ hôi IP55,Shokz,,12 giờ,,,,,,,,,,
https://cellphones.com.vn/tai-nghe-khong-day-xiaomi-buds-5-pro-wifi.html,Tai nghe không dây Xiaomi Buds 5 Pro Wifi,Xiaomi,Liên hệ,tai-nghe-khong-day-xiaomi-buds-5-pro-wifi,"Mua Tai nghe Xiaomi Buds 5 Pro chính hãng - Giá tốt, có trả góp, Giảm thêm Smember, bảo hành 12 tháng, giao toàn quốc. Mua Buds 5 pro tại đây.",Tai nghe: 25.78 × 31.39 × 21.24 mmHộp sạc: 60.5 × 48.45 × 26.79 mm,Tai nghe: 5.6g (±0.1g) Hộp sạc: 41.8g (±0.5g),Hi-Res AudioQualcomm® aptX™ LosslessHarman AudioEFX,3 micro,Cảm ứng chạm,Điều khiển cử chỉ AI để phiên âm và dịch thuậtChống bụi &amp; nước IP54,Xiaomi,,Tai nghe: 8 giờHộp sạc: 40 giờ,,,,,,,,,,
https://cellphones.com.vn/tai-nghe-bluetooth-powerbeat-pro.html,Tai nghe Bluetooth PowerBeats Pro,Apple Chính hãng,Liên hệ,NB.199,"Mua tai nghe PowerBeats Pro chính hãng - Giá rẻ, Giảm thêm Smember, bảo hành 12 tháng, giao hàng toàn quốc. Mua ngay PowerBeat Pro tại đây.",7.7 x 7.7 x 4.3 cm,Tai nghe: 20.3g,,Có,Phím nhấn,Sử dụng độc lập 1 bên tai ngheTrợ lý ảo Siri Sạc nhanh,Apple Chính hãng,,Tai nghe: 9 giờHộp sạc: 24 giờ,Apple H1,,,,,,,,,
https://cellphones.com.vn/tai-nghe-bluetooth-honor-choice-earbuds-x7e.html,Tai nghe Bluetooth True Wireless HONOR CHOICE Earbuds X7e,HONOR,Liên hệ,tai-nghe-bluetooth-honor-choice-earbuds-x7e,"Mua Tai nghe HONOR CHOICE Earbuds X7e chính hãng - Giá tốt, bảo hành uy tín, giao hàng toàn quốc. Mua ngay HONOR CHOICE Earbuds X7e tại đây.",Tai nghe: 33.6 × 18.4 × 18.2 mmHộp sạc: 56 × 22.8 mm (Đường kính x độ dày),Tai nghe: 4.8g,Chống ồn,Có,Cảm ứng chạm,Công nghệ khử ồn cuộc gọi AICông nghệ nhận diện đeoChống ồn ENC,HONOR,,Tai nghe: 8 giờ Hộp sạc: 32 giờ,,,,,,,,,,
https://cellphones.com.vn/tai-nghe-chup-tai-jbl-live-670nc.html,Tai nghe Bluetooth chụp tai JBL Live 670NC,JBL,Liên hệ,tai-nghe-chup-tai-jbl-live-670nc,"Mua Tai nghe chụp tai JBL Live 670NC chính hãng - Giá tốt, bảo hành uy tín, giao hàng tận nơi toàn quốc. Mua ngay JBL Live 670NC tại đây.",Dài 18 cm - Rộng 16 cm - Cao 6.5 cm,219g,Chống ồn ANC,Có (2 Micro),Nút bấm và Ứng dụng,Gọi Alexa hoặc Hey Google,JBL,3.5mm,ANC Tắt: 65 giờANC bật ANC: 50 giờ,,,,,,,,,,
https://cellphones.com.vn/tai-nghe-bluetooth-havit-tw992.html,Tai nghe Bluetooth True Wireless Havit TW992,Havit,Liên hệ,tai-nghe-bluetooth-havit-tw992,"Mua Tai nghe Havit TW992 chính hãng - Giá tốt, bảo hành uy tín, giao hàng tận nơi toàn quốc. Mua ngay Havit TW992 tại đây.",Tai nghe: 5 gHộp sạc: 34 g,Tai nghe: 20.66 x 26.88 x 23.75 mm Hộp sạc: 62.78 x 48.56 x 26.42 mm,Chống ồn chủ động ANCChống ồn môi trường ENC,Có (4 micro),Cảm ứng chạm,,Havit,,Tai nghe: 8.5 giờHộp sạc: 34 giờ (Tắt ANC),,,,,,,,,,
https://cellphones.com.vn/tai-nghe-bluetooth-baseus-wm01.html,Tai nghe Bluetooth True Wireless Baseus WM01,Baseus,Liên hệ,tai-nghe-bluetooth-baseus-wm01,"Mua Tai nghe bluetooth Baseus WM01 chính hãng - Giá rẻ, chất lượng, bảo hành uy tín, giao hàng toàn quốc. Mua ngay Baseus WM01 tại đây",,Tai nghe: 4 gramHộp sạc: 32 gram,,Có,Chạm cảm ứng,,Baseus,,Tai nghe: Dùng 5 giờ  Hộp sạc: Dùng 25 giờ,,,,,,,,,,
https://cellphones.com.vn/tai-nghe-khong-day-shokz-openfit-2-plus.html,Tai nghe không dây Shokz OpenFit 2 Plus,Shokz,Liên hệ,tai-nghe-khong-day-shokz-openfit-2-plus,Tai nghe thể thao Shokz OpenFit 2 Plus chính hãng chất lượng. Giá cạnh tranh. Ưu đãi tốt. Bảo hành uy tín. Mua tai nghe không dây Shokz OpenFit 2+ giao nhanh,,Tai nghe: 9.4g ± 0.2g  Hộp sạc: 56g ± 2.0g  Tổng trọng lượng: 74.8g ± 2.0g,Shokz DualBoost™,4 micro ,Nút vật lý đa chức năng  Nút cảm ứng (chỉ dùng cho trợ lý giọng nói),Kháng nước và mồ hôi IP55,Shokz,, Nghe nhạc: Lên đến 48 giờ với hộp sạc  Đàm thoại: Lên đến 36 giờ với hộp sạc,,,,,,,,,,
https://cellphones.com.vn/tai-nghe-bluetooth-anker-soundcore-c50i.html,Tai nghe Bluetooth thể thao Anker Soundcore C50i,Anker,Liên hệ,tai-nghe-bluetooth-anker-soundcore-c50i,"Mua tai nghe Anker Soundcore C50i chính hãng - Giá tốt, bảo hành uy tín, giao hàng tận nơi toàn quốc. Mua ngay Anker Soundcore C50i tại đây.",,Tai nghe: 5.5 g,,Có (2 micro AI),,"Kháng nước, bụi IP55",Anker,,Tai nghe: 7 giờ  Hộp sạc: 28 giờ,,,,,,,,,,
https://cellphones.com.vn/tai-nghe-samsung-galaxy-buds-4.html,Tai nghe Samsung Galaxy Buds 4,Samsung Chính hãng,Liên hệ,tai-nghe-samsung-galaxy-buds-4,"Tai nghe Samsung Galaxy Buds 4 chính hãng, chất âm cải tiến Hi-Fi cao cấp, tích hợp Galaxy AI. Mua Galaxy Buds4 giá tốt, trả góp 0% tại CellphoneS",tai nghe: 18.3x19.3x30.5mm  hộp sạc: 51x51x28.3mm,tai nghe: 4.6g  hộp sạc: 45.1g,,,,Bộ khuếch đại đơn,Samsung Chính hãng,,"Bật ANC: tai nghe 5h, hộp sạc + tai nghe 24h  Tắt ANC: tai nghe 6h, hộp sạc + tai nghe 30h",,,,,,,,,,
https://cellphones.com.vn/tai-nghe-chup-tai-baseus-bowie-30-max.html,Tai nghe chụp tai bluetooth Baseus Bowie 30 Max,Baseus,Liên hệ,tai-nghe-chup-tai-baseus-bowie-30-max,"Mua Tai nghe chụp tai bluetooth Baseus Bowie 30 Max chính hãng - Giá tốt, bảo hành uy tín, giao hàng tận nơi toàn quốc. Mua ngay Baseus Bowie 30 Max tại đây.",Dài 8.8 cm - Rộng 7.625 cm - Cao 4.58 cm,320 g,Bass Enhancement Spatial Audio Hi-Res Audio Driver 50 mm Active Noise Cancelling Công nghệ ENC codec LDAC,2 Micro chống ồn,Phím nhấn,,Baseus,3.5mm,65 giờ,,,,,,,,,,
https://cellphones.com.vn/tai-nghe-chup-tai-edifier-w80.html,Tai nghe Bluetooth chụp tai Edifier W80,Edifier,Liên hệ,tai-nghe-chup-tai-edifier-w80,"Mua tai nghe Edifier W80 chính hãng - Giá tốt, bảo hành uy tín, giao hàng tận nơi toàn quốc. Mua ngay Edifier W80 tại đây.",,,Chống ồn chủ động ANCHi-Res AudioHi-Res Wireless AudioSpatial SoundAmbient Sound,Có,Nút bấm vật lý,Độ trễ thấp 0.08s,Edifier,,Bật ANC: 40 giờ Tắt ANC: 65 giờ,,,,,,,,,,
https://cellphones.com.vn/tai-nghe-bluetooth-true-wireless-havit-tw907-se.html,Tai nghe Bluetooth True Wireless Havit TW907 SE,Havit,Liên hệ,tai-nghe-bluetooth-true-wireless-havit-tw907-se,"Mua Tai nghe Havit TW907 SE chính hãng - Giá cực tốt, bảo hành uy tín, giao hàng nhanh toàn quốc. Mua ngay Havit TW907 SE tại đây.",Tai nghe: 19.9 x 26.46 x 22.73 mmHộp sạc: 63 x 45.34 x 27.22 mm,Tai nghe: 5 g Hộp sạc: 31 g,,Có (2 Micro AI),,Chống ồn môi trường ENC,Havit,,Tai nghe: 8 giờHộp sạc: 30 giờ,,,,,,,,,,
https://cellphones.com.vn/tai-nghe-khong-day-soundpeats-mini-hs.html,Tai nghe Bluetooth True Wireless SoundPEATS Mini HS,Soundpeats,Liên hệ,T.SP.07,"Mua Tai nghe không dây SoundPEATS Mini Hs chính hãng - Giá tốt, bảo hành uy tín, giao hàng toàn quốc. Mua ngay Soundpeats Mini Hs tại đây.",,,Hires Audio  Game Mode  ANC,"3 Micrô trên mỗi tai nghe, tổng cộng là 6 micrô + ENC",Cảm ứng chạm,,Soundpeats,,,,,,,,,,,,
https://cellphones.com.vn/tai-nghe-chup-tai-tronsmart-sounfii-q20.html,Tai nghe Bluetooth chụp tai Tronsmart Sounfii Q20,Hãng khác,Liên hệ,tai-nghe-chup-tai-tronsmart-sounfii-q20,"Mua Tai nghe bluetooth Tronsmart Sounfii Q20i chính hãng - Giá tốt, giảm Smember, bảo hành 12 tháng, giao hàng tận nơi. Mua Sounfii Q20 tại đây.",186 x 181.9 x 82.3 mm,246 gr,Dải tần số đáp ứng: 20Hz – 20KHz Driver 40mm,,,"Trợ lý giọng nói, Hỗ trợ Siri, Trợ lý Google",Hãng khác,,60 giờ,,,,,,,,,,
https://cellphones.com.vn/tai-nghe-khong-day-anker-soundcore-r50i-nc.html,Tai nghe Bluetooth True Wireless Anker Soundcore R50I NC,Anker,Liên hệ,tai-nghe-khong-day-anker-soundcore-r50i-nc,"Mua Tai nghe Anker Soundcore R50I NC chính hãng - Giá tốt, bảo hành uy tín, giao hàng tận nơi toàn quốc. Mua ngay Anker Soundcore R50I NC tại đây.",,Tai nghe: 5g Hộp sạc: 40g,Chống ồn chủ động (ANC),Có (4 micro AI),Cảm ứng chạm,Sạc nhanhChống ồn đàm thoại Chống nước IP54,Anker,,Tai nghe: 10 giờHộp sạc: 45 giờ,,,,,,,,6W,10 giờ,
https://cellphones.com.vn/tai-nghe-khong-day-huawei-freebuds-6i.html,Tai nghe Bluetooth True Wireless Huawei Freebuds 6i,Huawei,Liên hệ,tai-nghe-khong-day-huawei-freebuds-6i,"Mua Tai nghe Huawei Freebuds 6i chính hãng - Giá tốt, có trả góp, bảo hành uy tín, giao hàng toàn quốc. Mua ngay Freebuds 6i tại đây.",Tai nghe: 31.4 x 21.3 x 23.7 mmHộp sạc: 48.2 x 61.8 x 27 mm,"Tai nghe: 5,4 ± 0,3 gHộp sạc: 34 ± 1 g",Chống ồn chủ động ANC,Có,Cảm ứng chạm,Chống ồn đàm thoại Kháng nước và bụi IP54,Huawei,,Tai nghe: 8 giờHộp sạc: 35 giờ (Tắt ANC),,,,,,,,,,
https://cellphones.com.vn/tai-nghe-bluetooth-xiaomi-redmi-buds-8-pro.html,Tai nghe Bluetooth Xiaomi Redmi Buds 8 Pro,Xiaomi,Liên hệ,tai-nghe-bluetooth-xiaomi-redmi-buds-8-pro,"Mua Tai nghe Xiaomi Redmi Buds 8 Pro chính hãng - Giá tốt, bảo hành uy tín, giao hàng tận nơi toàn quốc. Mua ngay Xiaomi Redmi Buds 8 Pro tại đây.",Tai nghe: 30.6 × 21.4 × 24.52 mmHộp sạc: 61.01 × 25.17 × 48.28 mm,"Khoảng 5.3g (tai nghe), 41.6g (tổng cộng)",Hi-Res Audio Wireless,,,,Xiaomi,Type C,"Tai nghe: khoảng 8.5 giờ (tắt ANC)  Tai nghe + hộp sạc: khoảng 35 giờ (tắt ANC, kèm hộp sạc)",,,,,,,,,,
https://cellphones.com.vn/tai-nghe-bluetooth-earfun-air-2.html,Tai nghe Bluetooth True Wireless EarFun Air 2,EarFun,Liên hệ,tai-nghe-bluetooth-earfun-air-2,"Mua Tai nghe EarFun Air 2 chính hãng - Giá tốt, bảo hành uy tín, giao hàng tận nơi toàn quốc. Mua ngay EarFun Air 2 tại đây.",,,Âm thanh Hi-Res Wireless,Có4 mic AI,Cảm ứng chạm,Công nghệ SweatShield™Sạc nhanh,EarFun,,,,15m,,,,,,,,
https://cellphones.com.vn/tai-nghe-khong-day-soundpeats-pop-clip.html,Tai nghe không dây thể thao SoundPEATS Pop Clip,Soundpeats,Liên hệ,tai-nghe-khong-day-soundpeats-pop-clip,"Mua Tai nghe không dây SoundPEATS Pop Clip chính hãng - Giá tốt, bảo hành 1 năm, Giảm thêm Smember. Mua ngay SoundPEATS Pop Clip tại đây.","Tai nghe: 27,4 * 26,7 * 22,5 mm  17 Hộp sạc: 63,7 * 49,8 * 30,6 mm",,,Mic 2 chiều lọc ồn dạng vòm hình chữ C,,,Soundpeats,,,,,,,,,,,,
https://cellphones.com.vn/tai-nghe-khong-day-anker-soundcore-k20i-a3994.html,Tai nghe Bluetooth True Wireless Anker Soundcore K20i - A3994,Anker,Liên hệ,tai-nghe-khong-day-anker-soundcore-k20i-a3994,"Mua Tai nghe Anker Soundcore K20i - A3994 chính hãng - Giá tốt, bảo hành uy tín, giao hàng tận nơi toàn quốc. Mua ngay Anker Soundcore K20i - A3994 tại đây.",Dài 1.6 cm - Rộng 1.6 cm - Cao 3.3 cm,3.3 g,EQ Sound Bassup ,2 Micro chống ồn,Cảm ứng chạm,Chống ồn đàm thoại ENCChống nước IPX5  Game Mode ,Anker,,Tai nghe: 6 giờHộp sạc: 36 giờ,,,,,,,,,,
https://cellphones.com.vn/tai-nghe-khong-day-xiaomi-openwear-stereo.html,Tai nghe thể thao Xiaomi Openwear Stereo,Xiaomi,Liên hệ,tai-nghe-khong-day-xiaomi-openwear-stereo,"Mua tai nghe thể thao Xiaomi Openwear Stereo chính hãng - Giá tốt, góp 0%, giảm thêm Smember, bảo hành 1 năm,. Mua ngay Xiaomi Openwear Stereo tại đây.","Tai nghe: 54,24 × 39,3 × 13,79 mm Case sạc: 105,8 × 55,4 × 26,1 mm","Tai nghe: 9,6 g Case sạc: 68,78 g",Hi-Res,"Mic kép, chống ồn AI ",Cảm ứng chạm,,Xiaomi,,Tai nghe: 7.5 giờ Hộp sạc: 38.5 giờ,,,,,,,,,,
https://cellphones.com.vn/tai-nghe-asus-rog-cetra-tws-speednova.html,Tai nghe Bluetooth True Wireless Gaming Asus Rog Cetra SpeedNova,ASUS,Liên hệ,tai-nghe-asus-rog-cetra-tws-speednova,"Mua Tai nghe Asus Rog Cetra SpeedNova chính hãng, giá tốt - Tặng loa trị giá 649K, góp 0%, bảo hành 1 năm, giao toàn quốc. Mua Cetra SpeedNova tại đây.",,,Chống ồn chủ động Tuỳ chỉnh EQ/âm thanh 7.1 ,Có,Cảm ứng chạm,Sạc nhanh,ASUS,,,,10 m,,,,,,,,
https://cellphones.com.vn/tai-nghe-bluetooth-sony-wi-sp510.html,Tai nghe bluetooth Sony WI-SP510,Sony,Liên hệ,NB.303,"Mua ngay tai nghe bluetooth WI-SP510 chính hãng, giá rẻ nhất, nhiều khuyến mãi, bảo hành 12 tháng, giao hàng miễn phí tận nơi.",,,,,,,Sony,,,,,,,,,,,,15 giờ
https://cellphones.com.vn/tai-nghe-bluetooth-goojodoq-j201.html,Tai nghe Bluetooth GOOJODOQ J201,Goojodoq,Liên hệ,tai-nghe-bluetooth-goojodoq-j201,"Mua Tai nghe Bluetooth GOOJODOQ J201 chính hãng - Giá tốt, bảo hành uy tín, giao hàng tận nơi toàn quốc. Mua ngay GOOJODOQ J201 tại đây.",,,,Có,,Kháng nước IPX5,Goojodoq,,Đàm thoại: 2 - 3 giờNghe nhạc: 3.5 - 4 giờ,,,,,,,,,,
https://cellphones.com.vn/sony-mdr-zx310ap.html,Tai nghe chụp tai Sony MDR-ZX310AP,Sony,Liên hệ,sony-mdr-zx310ap,"Tai nghe Sony MDR-ZX310AP chính hãng, chất lượng tốt. Bảo hành lên đến 12 tháng. Nhận ngay túi đeo chéo Sony Extra Bass màu Vàng. Sony MDZ-ZX310AP thiết kế phần housing rất bóng bẩy, hạn chế trầy xước. Chụp tai bằng da cao cấp. Ăm thanh chuẩn.",,,,,,,Sony,,,,,,,,,,,,
https://cellphones.com.vn/tai-nghe-bluetooth-edifier-x3-lite.html,Tai nghe Bluetooth True Wireless Edifier X3 Lite,Edifier,Liên hệ,tai-nghe-bluetooth-edifier-x3-lite,"Mua Tai nghe chụp tai Edifier Bluetooth Edifier X3 Lite chính hãng - Giá tốt, nhiều ưu đãi, bảo hành uy tín, giao hàng toàn quốc. Mua ngay Edifier X3 Lite tại đây.",Tai nghe: 19.5 x 21.45 x 25.3mm Hộp sạc: 54.3 x 40.8 x 25mm,Tai nghe: 4gHộp sạc: 33g,,Có  2 micro,,Chống ồn môi trường ENC Chống bụi và chống mồ hôi tiêu chuẩn IP55,Edifier,,Tai nghe: 6 giờHộp sạc: 18 giờ,,,,,,,,,,
https://cellphones.com.vn/tai-nghe-khong-day-realme-buds-t300.html,Tai nghe Bluetooth True Wireless realme Buds T300,Realme,Liên hệ,tai-nghe-khong-day-realme-buds-t300,"Mua Tai nghe realme Buds T300 chính hãng - Giá tốt, bảo hành uy tín, giao hàng tận nơi toàn quốc. Mua ngay realme Buds T300 tại đây.",2.2 x 1.9 x 3 cm,4.1 g ± 0.3 g,Chống ồn chủ động ANC360 Spatial Sound,Có (2 micro),Cảm ứng chạm,Chống ồn cuộc gọi,Realme,,Tai nghe: 8 giờHộp sạc: 40 giờ,,,,,,,,,,
https://cellphones.com.vn/tai-nghe-bluetooth-trusmi-ws09.html,Tai nghe Bluetooth True Wireless Trusmi WS09,Trusmi,Liên hệ,tai-nghe-bluetooth-trusmi-ws09,"Mua tai nghe Trusmi WS09 chính hãng - Giá tốt, bảo hành uy tín, giao hàng tận nơi toàn quốc. Mua ngay Trusmi WS09 tại đây.",,,Chống ồn chủ động ANC,Có,,Chống ồn môi trường ENC,Trusmi,,Tai nghe: 6 giờHộp sạc: 35 giờ,,,,,,,,,,
https://cellphones.com.vn/tai-nghe-bluetooth-edifier-w600bt.html,Tai nghe Bluetooth chụp tai Edifier W600BT,Edifier,Liên hệ,TN.EDI.17,"Mua Tai nghe chụp tai Edifier W600BT chính hãng - Giá tốt, bảo hành uy tín, giao hàng tận nơi toàn quốc. Mua ngay Edifier W600BT tại đây.",,168g,,Có,Nút bấm vật lý,,Edifier,3.5mm,30 giờ,,,,,,,,,,
https://cellphones.com.vn/tai-nghe-bluetooth-baseus-bowie-e18.html,Tai nghe Bluetooth True Wireless Baseus Bowie E18,Baseus,Liên hệ,tai-nghe-bluetooth-baseus-bowie-e18,"Mua Tai nghe Baseus Bowie E18 chính hãng, giá tốt - Đa dạng màu, bảo hành 12 tháng, giao hàng toàn quốc. Mua Baseus Bowie E18 tại đây.",29.9mm(Cao ) x 36.23mm( Rộng ) x 62.75mm (Dài ),,Khử ồn ENC,Có,Cảm ứng chạm,Chống ồn đàm thoại ENC Sạc nhanh Kháng nước IPX4,Baseus,,Tai nghe: 7.5 giờHộp sạc: 25 giờ,,,,,,,,,,
https://cellphones.com.vn/tai-nghe-khong-day-anker-soundcore-v20i-a3876.html,Tai nghe Bluetooth True Wireless Anker Soundcore V20i - A3876,Anker,Liên hệ,tai-nghe-khong-day-anker-soundcore-v20i-a3876,"Mua Tai nghe Anker Soundcore V20i - A3876 chính hãng - Giá tốt, bảo hành uy tín, giao hàng tận nơi toàn quốc. Mua ngay Anker Soundcore V20i - A3876 tại đây.",,,,Có,Cảm ứng chạm,Chống ồn đàm thoại ENCSạc nhanh,Anker,,,,,,,,,,,,
https://cellphones.com.vn/tai-nghe-bluetooth-jbl-tune-beam.html,Tai nghe Bluetooth True Wireless JBL Tune Beam,JBL,Liên hệ,T.JBL.21,"Tai nghe JBL Tune Beam chính hãng - Giá rẻ, ưu đãi hấp dẫn, giảm Smember, hỗ trợ trả góp, giao toàn quốc. Mua ngay JBL Tune Beam tại đây.",Dài 3.4 cm - Rộng 2.5 cm - Cao 1.3 cm,Tai nghe: 5g Hộp sạc: 50.3 g,JBL Pure Bass Chống ồn chủ động ANC,Có (4 mic),Cảm ứng chạm,Chống ồn đàm thoại  Chống nước IP54,JBL,,Tai nghe: 12 giờHộp sạc: 36 giờ (Tắt ANC),,,,,,,,,,
https://cellphones.com.vn/tai-nghe-bluetooth-earfun-air-life.html,Tai nghe Bluetooth True Wireless EarFun Air Life,EarFun,Liên hệ,tai-nghe-bluetooth-earfun-air-life,"Mua Tai nghe EarFun Air Life chính hãng - Giá tốt, bảo hành uy tín, giao hàng tận nơi toàn quốc. Mua ngay EarFun Air Life tại đây.",,,Chống ồn môi trường ENC,Có (4 mic),Cảm ứng chạm,,EarFun,,,,,,,,,,,,
https://cellphones.com.vn/tai-nghe-bluetooth-havit-tw906-pro.html,Tai nghe Bluetooth Havit TW906 Pro,Havit,Liên hệ,tai-nghe-bluetooth-havit-tw906-pro,"Mua Tai nghe Havit TW906 Pro chính hãng - Giá tốt, bảo hành uy tín, giao hàng tận nơi toàn quốc. Mua ngay Havit TW906 Pro tại đây.",,Tai nghe: 3.9gHộp sạc: 39.7g,Chống ồn chủ động ANC,Có ( 4mic),Cảm ứng chạm,Chống ồn môi trường (ENC),Havit,,Tai nghe: 5 giờHộp sạc: 23 giờ (Tắt ANC),,,,,,,,,,
https://cellphones.com.vn/tai-nghe-khong-day-nokia-e3500.html,Tai nghe Bluetooth True Wireless Nokia E3500,Nokia,Liên hệ,NA.328,"Mua Tai nghe Nokia E3500 chính hãng - Giá rẻ, cao cấp, bảo hành 12 tháng, giao hàng tận nơi toàn quốc. Mua ngay Nokia E3500 tại đây.",,,Chống ồn đàm thoại,Có,Cảm ứng chạm ,Tự động kết nối khi mở hộp sạc,Nokia,,,,10 m,Tai nghe: Dùng 7 giờHộp sạc: Dùng 25 giờ,,,,,,,
https://cellphones.com.vn/tai-nghe-bluetooth-anker-soundcore-liberty-4.html,Tai nghe không dây chống ồn Anker Soundcore Liberty 4 NC (A3947),Anker,Liên hệ,tai-nghe-bluetooth-anker-soundcore-liberty-4,"Mua Tai nghe Anker Soundcore Liberty 4 A3947 chính hãng, giá tốt - Đa dạng màu, bảo hành uy tín, giao toàn quốc. Mua Soundcore Liberty 4 NC tại đây",,,Âm thanh Hi-Res Adaptive ANC 2.0,Có 6 micro,Chạm cảm ứng,Chống nước IPX4,Anker,,Tai nghe: 10 giờHộp sạc: 50 giờ,,,,,,,,,,
https://cellphones.com.vn/tai-nghe-bluetooth-bose-quietcomfort-ultra-earbuds-2.html,Tai nghe Bluetooth True Wireless Bose Quietcomfort Ultra Earbuds 2,Bose,Liên hệ,tai-nghe-bluetooth-bose-quietcomfort-ultra-earbuds-2,"Mua tai nghe Bose Quietcomfort Ultra Earbuds 2 chính hãng - Giá tốt, bảo hành uy tín, giao hàng tận nơi toàn quốc. Mua ngay Bose Ultra Earbuds 2 tại đây.",,,Bose Immersive AudioActiveSense Aware Mode,Có,,Quiet ModeCông nghệ CustomTune,Bose,,Thời lượng 6 giờ,,,,,,,,,,
https://cellphones.com.vn/tai-nghe-bluetooth-edifier-evobuds.html,Tai nghe Bluetooth True Wireless Edifier Evobuds,Edifier,Liên hệ,tai-nghe-bluetooth-chup-tai-edifier-evobuds,"Mua tai nghe Edifier Evobuds chính hãng - Giá tốt, bảo hành uy tín, giao hàng tận nơi toàn quốc. Mua ngay Edifier Evobuds tại đây.",,,Chống ồn chủ động Adaptive ANCHi-Res Audio Wireless,Có,,Dịch giọng nói AI thời gian thựcĐộ trễ: 80ms ,Edifier,,Tai nghe: 7 giờHộp sạc: 28 giờ (Tắt ANC)Tai nghe: 5 giờHộp sạc: 25 giờ (Bật ANC),,,,,,,,,,
https://cellphones.com.vn/tai-nghe-khong-day-soundpeats-air-5-pro.html,Tai nghe Bluetooth True Wireless SoundPEATS Air 5 Pro,Soundpeats,Liên hệ,tai-nghe-khong-day-soundpeats-air-5-pro,"Mua Tai nghe SoundPEATS Air 5 Pro chính hãng - Giá tốt, bảo hành uy tín, giao hàng toàn quốc. Mua ngay SoundPEATS Air 5 Pro tại đây.",Tai nghe: 34 x 6 x 19.87 x 23.5 mmHộp sạc: 66.88 x 48.33 x 26.92 mm,Tai nghe: 4.8gTai nghe + Hộp sạc: 50.3g,Chống ồn 55dBHi-Res Audio Wireless,Có,Chạm,Tai nghe chống nước IPX5,Soundpeats,,Tai nghe: 7 giờHộp sạc: 37 giờ,,,,,,,,,,
https://cellphones.com.vn/tai-nghe-khong-day-nakamichi-tw016.html,Tai nghe Bluetooth True Wireless NAKAMICHI TW016,Nakamichi,Liên hệ,tai-nghe-khong-day-nakamichi-tw016,"Mua Tai nghe NAKAMICHI TW016 chính hãng - Giá tốt, bảo hành uy tín, giao hàng tận nơi toàn quốc. Mua ngay NAKAMICHI TW016 tại đây.",Tai nghe: 31.91 x 17.8 x 16.85gHộp sạc: 53 x 24.5 x 47.42g,Tai nghe: 3gHộp sạc: 30g,,Có,Cảm ứng chạm,Độ trễ thấp,Nakamichi,,Tai nghe: 5 giờ Hộp sạc: 20 giờ,,,,,,,,,,
https://cellphones.com.vn/tai-nghe-khong-day-soundpeats-clear.html,Tai nghe Bluetooth True Wireless SoundPEATS Clear,Soundpeats,Liên hệ,T.SP.29,"Mua Tai nghe Soundpeats Clear chính hãng, giá tốt - Đa dạng màu, bảo hành uy tín, giao hàng toàn quốc. Mua ngay Soundpeats Clear tại đây.",Tai nghe: 57 × 30 × 50 mm  Hộp sạc: 21 × 24 × 33 mm,Tai nghe: 4.2g  Hộp sạc: 45g,,Có2 mic hỗ trợ ENC,Cảm ứng chạm,Game Mode Chống nước IPX4,Soundpeats,,Tai nghe: 7 giờHộp sạc: 40 giờ  ,JL6973D8,,,,,,,,,
https://cellphones.com.vn/tai-nghe-bluetooth-earfun-clip-anc.html,Tai nghe Bluetooth Open Ear Earfun Clip,EarFun,Liên hệ,tai-nghe-bluetooth-earfun-clip-anc,"Mua Tai nghe Bluetooth Open Ear Earfun Clip chính hãng - Giá tốt, bảo hành uy tín, giao hàng tận nơi toàn quốc. Mua ngay Tai nghe Bluetooth Open Ear Earfun Clip tại đây.","66m x 48,3 x 28 mm","49,2g",Immersive 3D surround,Có (2 mic),Phím vật lý,Game mode  Dual connect  Micro đàm thoại công nghệ giảm ồn,EarFun,Type C,40,,,,,,,,,,
https://cellphones.com.vn/tai-nghe-bluetooth-havit-owsfit-02a.html,Tai nghe Bluetooth thể thao Havit OWSFIT 02A,Havit,Liên hệ,tai-nghe-bluetooth-havit-owsfit-02a,"Mua Tai nghe Havit OWSFIT 02A chính hãng - Giá tốt, bảo hành uy tín, giao hàng tận nơi toàn quốc. Mua ngay Havit OWSFIT 02A tại đây.",,Tai nghe: 7.9g,,Có,Cảm ứng chạm,Kháng nước chuẩn IPX5Chống ồn môi trường ENC,Havit,,Tai nghe: 8.5 giờHộp sạc: 64 giờ,,,,,,,,,,
https://cellphones.com.vn/tai-nghe-bluetooth-oppo-enco-x3i.html,Tai nghe Bluetooth True Wireless OPPO Enco X3i,OPPO,Liên hệ,tai-nghe-bluetooth-oppo-enco-x3i,"Mua Tai nghe OPPO Enco X3i chính hãng - Giá tốt, trả góp 0%, bảo hành uy tín, giao hàng tận nơi toàn quốc. Mua ngay OPPO Enco X3i tại đây.",Tai nghe: 31.7 x 20.27 x 24.4 mm  Hộp sạc: 58.7 x 50.2 x 25.8 mm ,Tai nghe: ~4.8g  Hộp sạc: ~ 40.8g,OPPO Alive AudioHi-Res AudioChống ồn chủ động ANC,Có,Cảm ứng chạm,Sạc nhanh,OPPO,,ANC On: 6.5h（Tai nghe）/ 28h（Tai nghe + hộp sạc） ANC OFF: 10h（Tai nghe）/ 44h（Tai nghe + hộp sạc）,,,,,,,,,,
https://cellphones.com.vn/tai-nghe-bluetooth-xiaomi-redmi-buds-6-play.html,Tai nghe Bluetooth True Wireless Xiaomi Redmi Buds 6 Play,Xiaomi,Liên hệ,tai-nghe-bluetooth-xiaomi-redmi-buds-6-play,"Mua Tai nghe Xiaomi Redmi Buds 6 Play chính hãng - Giá tốt, bảo hành uy tín, giao hàng tận nơi toàn quốc. Mua ngay Xiaomi Redmi Buds 6 Play tại đây.",Tai nghe: 29.5 x 21.4 x 23.5mmHộp sạc: 61 x 50 x 24.6mm,Tai nghe: 5.3gHộp sạc: 42g,,Có,Cảm ứng chạm,Chống ồn môi trường ENC,Xiaomi,,Tai nghe: 7.5 giờHộp sạc: 36 giờ,,,,,,,,,,
https://cellphones.com.vn/tai-nghe-chup-tai-earfun-wave-pro.html,Tai nghe Bluetooth True Wireless EarFun Wave Pro,EarFun,Liên hệ,tai-nghe-chup-tai-earfun-wave-pro,"Mua Tai nghe EarFun Wave Pro chính hãng - Giá tốt, bảo hành uy tín, giao hàng tận nơi toàn quốc. Mua ngay EarFun Wave Pro tại đây.",,,Chống ồn chủ động ANCÂm thanh Hi-resCông nghệ LDAC,Có (5 mic),Cảm ứng chạm,Sạc nhanh&lt;,EarFun,,,,15m,Bật ANC: 55 giờTắt ANC: 80 giờ,,,,,,,
